Property Name,Property Code,Brand,#Rooms,Activation Date,Revenue,Profit Margin,Gross Profit,Flag,Size Subset,SPOR,Group,Type
Embassy Suites Bloomington,MSPWE,Hilto,234.0,2015-10-19,7846.75,0.63175,4957.21,Embassy Suites,5,1.610496775373634,All Suites,All Suites
Embassy Suites Minneapolis Airport,MSPAP,Hilto,310.0,2018-05-09,6959.51,0.68812,4788.98,Embassy Suites,5,1.0782087955807678,All Suites,All Suites
Embassy Suites Lombard,CHILM,Hilto,262.0,2016-09-14,6919.62,0.61586,4261.49,Embassy Suites,5,1.2684310215727237,All Suites,All Suites
Tru by Hilton Raleigh Durham Airport,RDUAT,Hilto,106.0,2018-08-20,6727.2,0.67987,4573.59,Tru by Hilton,3,3.0479958765606976,Select Service,Focused Service
Hilton Garden Inn Los Angeles Montebello,LGBMB,Hilto,121.0,2015-03-30,6705.1,0.71097,4767.1,Hilton Garden Inn,3,2.6613732655884683,Select Service,Focused Service
Tru by Hilton North Platte,LBFRU,Hilto,98.0,2018-05-14,6704.66,0.59497,3989.05,Tru by Hilton,2,3.285765645252222,Select Service,Focused Service
Crowne Plaza Atlanta Airport,IHG-ATLAT,IHG,378.0,2017-06-27,8359.55,0.65976,5515.3,Crowne Plaza,5,1.0621283494165499,Full service,Full service
Hampton Inn Indianapolis Dwtn Across from Circle Centre,INDDT,Hilto,180.0,2018-01-16,6549.25,0.56673,3711.66,Hampton Inn by Hilton,4,1.7474508309746715,Select Service,Focused Service
The Saratoga Hilton (Coffee Shop),ALBSA:Coffee Shop,Hilto,245.0,2017-08-11,6504.19,0.58009,3773.03,Hilton Hotels & Resorts,5,1.275008370428511,Full Service,Full Service
Homewood Suites by Hilton Washington DC NoMa Union Station,DCANE,Hilto,114.0,2018-09-13,6364.61,0.66238,4215.8,Homewood Suites by Hilton,3,2.6813459234977977,All Suites,All Suites
Hampton Inn & Suite Yonkers Westchester,LGAYW,Hilto,150.0,2016-12-14,6322.38,0.66317,4192.8,Hampton Inn & Suites by Hilton,4,2.024301686709955,Select Service,Focused Service
Hilton Garden Inn Laramie,LARLA,Hilto,135.0,2015-07-21,6254.91,0.71085,4446.3,Hilton Garden Inn,3,2.2252212446049615,Select Service,Focused Service
The Saratoga Hilton (Gift Shop),ALBSA:Gift Shop,Hilto,245.0,2017-07-17,6196.8,0.61987,3841.19,Hilton Hotels & Resorts,5,1.2147510865874762,Full Service,Full Service
Crowne Plaza Kansas City Downtown,MKCWS,IHG,385.0,2018-11-27,8412.25,0.5839,4911.9,Crowne Plaza,5,1.049391017020786,Full service,Full service
Hampton Inn & Suites Columbia South,BALCO,Hilto,124.0,2015-06-30,5862.41,0.58609,3435.88,Hampton Inn & Suites by Hilton,3,2.270598801244861,Select Service,Focused Service
Hampton Inn & Suites Hood River,PDXHR,Hilto,88.0,2018-09-17,5724.98,0.54066,3095.29,Hampton Inn & Suites by Hilton,2,3.1244760685581756,Select Service,Focused Service
Hilton Garden Inn New York Midtown Park Ave,NYCET,Hilto,232.0,2015-10-15,5721.32,0.62723,3588.56,Hilton Garden Inn,5,1.1843884268723592,Select Service,Focused Service
Hilton Garden Inn Denver Airport,DENAH,Hilto,157.0,2013-10-10,5719.36,0.63758,3646.55,Hilton Garden Inn,4,1.7495795033036488,Select Service,Focused Service
Hilton Garden Inn Riverhead,ISPRH,Hilto,114.0,2018-05-24,5715.29,0.65729,3756.58,Hilton Garden Inn,3,2.407793964297534,Select Service,Focused Service
Tru by Hilton Chicopee Springfield,BDLRU,Hilto,108.0,2018-06-13,5604.17,0.60232,3375.53,Tru by Hilton,3,2.49214579873607,Select Service,Focused Service
Hampton Inn Washington DC NoMa Union Station,DCANY,Hilto,125.0,2018-09-05,5438.74,0.64727,3520.32,Hampton Inn by Hilton,3,2.0896530525992234,Select Service,Focused Service
Crowne Plaza Milwaukee West,MKEMR,IHG,198.0,2017-09-28,8545.93,0.58018,4958.19,Crowne Plaza,4,2.0729080678844385,Full service,Full service
Hilton Garden Inn Houston Hobby Airport,HOUMR,Hilto,136.0,2018-11-20,5148.23,0.60551,3117.3,Hilton Garden Inn,3,1.8180462766041598,Select Service,Focused Service
Tru By Hilton Charlotte Ayrsley,CLTCA,Hilto,92.0,2018-04-27,5071.35,0.58173,2950.17,Tru by Hilton,2,2.647412761997992,Select Service,Focused Service
Hilton Garden Inn Tampa - Wesley Chapel,TPAWL,Hilto,124.0,2018-10-04,5041.66,0.73819,3721.69,Hilton Garden Inn,3,1.9527100889027151,Select Service,Focused Service
DoubleTree Suites Salt Lake City Downtown,SLCWS,Hilto,241.0,2016-03-04,5019.88,0.67739,3400.4,DoubleTree by Hilton,5,1.0003735348561587,Full Service,Full Service
Tru by Hilton Madison West,MSNCB,Hilto,106.0,2018-04-11,5000.09,0.58231,2911.61,Tru by Hilton,3,2.2654676094708615,Select Service,Focused Service
Hilton Garden Inn Seattle Issaquah,SEAIS,Hilto,179.0,2015-11-03,4849.91,0.63931,3100.58,Hilton Garden Inn,4,1.3012673989387469,Select Service,Focused Service
Tru by Hilton Fort Wayne North,FWARU,Hilto,92.0,2018-06-27,4818.02,0.56723,2732.91,Tru by Hilton,2,2.5151661067687234,Select Service,Focused Service
Hilton Garden Inn Cincinnati Midtown,CVGMD,Hilto,120.0,2018-10-17,4793.75,0.68882,3302.02,Hilton Garden Inn,3,1.9185805445626976,Select Service,Focused Service
TRU by Hilton Syracuse - Camillus,SYRRU,Hilto,92.0,2018-07-19,4764.41,0.63466,3023.78,Tru by Hilton,2,2.4871799101601844,Select Service,Focused Service
Crowne Plaza Palo Alto,SFOCA,IHG,195.0,2017-06-29,8615.61,0.66993,5771.86,Crowne Plaza,4,2.121960626686488,Full service,Full service
Hampton Inn Asheville-Tunnel Rd.,AVLTU,Hilto,120.0,2016-05-27,4659.97,0.60376,2813.51,Hampton Inn by Hilton,3,1.8650383896210345,Select Service,Focused Service
"Hampton Inn & Suites Roseburg, OR",OTHRO,Hilto,90.0,2018-04-22,4658.16,0.64656,3011.77,Hampton Inn & Suites by Hilton,2,2.4857519755126085,Select Service,Focused Service
Tru By Hilton Lake Charles,LCHRU,Hilto,98.0,2018-05-23,4653.98,0.69235,3222.17,Tru by Hilton,2,2.28078494624499,Select Service,Focused Service
Tru by Hilton Bowling Green,BWGRU,Hilto,88.0,2018-07-02,4647.95,0.56639,2632.54,Tru by Hilton,2,2.536674109403871,Select Service,Focused Service
Homewood Suites San Diego Airport Liberty Station,SANLS,Hilto,150.0,2014-10-21,4610.41,0.5588,2576.28,Homewood Suites by Hilton,4,1.4761625747621059,All Suites,All Suites
Hilton Garden Inn Abilene,ABIAB,Hilto,123.0,2015-03-19,4526.16,0.60053,2718.08,Hilton Garden Inn,3,1.7673016857728416,Select Service,Focused Service
Tru by Hilton Meridian Boise West,BOIMW,Hilto,92.0,2018-04-21,4506.15,0.63992,2883.59,Tru by Hilton,2,2.352359631553186,Select Service,Focused Service
Homewood Suites Harrisburg West Hershey Area,HARHW,Hilto,116.0,2015-06-13,4496.69,0.60068,2701.08,Homewood Suites by Hilton,3,1.861747846732107,All Suites,All Suites
Tru By Hilton St. Charles St. Louis,STLMO,Hilto,87.0,2018-06-21,4482.39,0.59957,2687.51,Tru by Hilton,2,2.474436361179306,Select Service,Focused Service
"Hilton Garden Inn Seattle/Bothell, WA",SEABO,Hilto,128.0,2017-05-22,4475.55,0.54736,2449.72,Hilton Garden Inn,3,1.6792770188169974,Select Service,Focused Service
Hilton Garden Inn Portland Downtown Waterfront,PWMDH,Hilto,120.0,2018-01-31,4428.85,0.50253,2225.63,Hilton Garden Inn,3,1.772538293566937,Select Service,Focused Service
Hilton Garden Inn Ottawa Downtown,YOWCD,Hilto,175.0,2018-12-31,4407.59,0.51105,2252.5,Hilton Garden Inn,4,1.2096202295418494,Select Service,Focused Service
Hilton Garden Inn New Orleans French Quarter CBD,MSYOR,Hilto,155.0,2016-01-16,4393.43,0.64959,2853.92,Hilton Garden Inn,4,1.3613127558602294,Select Service,Focused Service
Hilton Dallas Plano Granite Park,DALPG,Hilto,299.0,2014-08-15,4355.13,0.66661,2903.19,Hilton Hotels & Resorts,5,0.6995452882541707,Full Service,Full Service
Hilton Garden Inn San Antonio Live Oak Convention Center,SATLI,Hilto,138.0,2017-06-27,4342.81,0.64805,2814.36,Hilton Garden Inn,3,1.5113938256982853,Select Service,Focused Service
Tru by Hilton Deadwood,RAPSD,Hilto,108.0,2018-06-28,4246.6,0.64575,2742.23,Tru by Hilton,3,1.8884413479449405,Select Service,Focused Service
Homewood Suites by Hilton Odessa,MAFOD,Hilto,121.0,2017-10-09,4227.38,0.63968,2704.18,Homewood Suites by Hilton,3,1.6779221958633548,All Suites,All Suites
Hampton Inn York,YRKPA,Hilto,144.0,2015-04-28,4201.8,0.72092,3029.18,Hampton Inn by Hilton,3,1.401389262432602,Select Service,Focused Service
Tru by Hilton San Antonio Downtown,SATDO,Hilto,94.0,2018-04-25,4193.74,0.57704,2419.95,Tru by Hilton,2,2.1426910189009933,Select Service,Focused Service
Hampton Inn & Suites Mount Vernon Belvoir Alexandria South Area,WASFB,Hilto,131.0,2014-12-30,4180.75,0.56827,2375.8,Hampton Inn & Suites by Hilton,3,1.5327411023842825,Select Service,Focused Service
Embassy Suites by Hilton Arcadia,LAXHD,Hilto,191.0,2018-06-08,4179.39,0.56797,2373.78,Embassy Suites,4,1.0509097781462142,All Suites,All Suites
Hampton Inn Oneonta,ONHNJ,Hilto,106.0,2014-12-08,4049.25,0.5393,2183.75,Hampton Inn by Hilton,3,1.834655919723422,Select Service,Focused Service
Doubletree by Hilton Denver Tech Center,DENEW,Hilto,305.0,2016-11-22,4044.05,0.70863,2865.73,DoubleTree by Hilton,5,0.6367993011040867,Full Service,Full Service
Tru by Hilton Fayetteville I-95,FAYRU,Hilto,109.0,2018-12-20,4034.27,0.66897,2698.81,Tru by Hilton,3,1.7775603880656043,Select Service,Focused Service
Home2 Suites Parc Lafayette,LFTHT,Hilto,106.0,2016-08-03,4021.88,0.56052,2254.34,Home2 Suites by Hilton,3,1.8222549732462152,All Suites,Focused Service
Embassy Suites Dallas Love Field,DALLF,Hilto,248.0,2016-11-02,4011.87,0.6107,2450.05,Embassy Suites,5,0.7769285338922235,All Suites,All Suites
Hilton Richmond Downtown,RICRD (RICDT),Hilto,250.0,2015-10-19,4006.01,0.70345,2818.04,Full Services,5,0.7695873515964191,Other,Other
Hilton Garden Inn Sun Prairie Madison,MSNSP,Hilto,124.0,2018-09-10,4001.67,0.58023,2321.9,Hilton Garden Inn,3,1.5499064557029487,Select Service,Focused Service
Embassy Suites Seattle North Lynnwood,SEALW,Hilto,240.0,2018-02-23,3985.61,0.57538,2293.24,Embassy Suites,5,0.7975711920953881,All Suites,All Suites
Hilton Garden Inn Dallas Arlington,DFWAR,Hilto,132.0,2015-03-11,3963.47,0.69157,2741.03,Hilton Garden Inn,3,1.4420739942553824,Select Service,Focused Service
DoubleTree by Hilton Hotel San Francisco Airport,SFOAO,Hilto,395.0,2018-05-24,3950.48,0.60878,2404.96,DoubleTree by Hilton,5,0.48032885032242556,Full Service,Full Service
Tru By Hilton Cheyenne,CYSND,Hilto,100.0,2017-08-14,3856.38,0.56393,2174.72,Tru by Hilton,3,1.8521055058208782,Select Service,Focused Service
Tru by Hilton Salt Lake City Airport,SLCRU,Hilto,95.0,2018-03-28,3840.83,0.56608,2174.23,Tru by Hilton,2,1.9417234733970592,Select Service,Focused Service
Homewood Suites by Hilton Ft.Lauderdale Airport-Cruise Port,FLLAR,Hilto,124.0,2018-08-29,3830.6,0.51695,1980.22,Homewood Suites by Hilton,3,1.4836484940576598,All Suites,All Suites
Hilton Garden Inn Orlando Airport,ORLAH,Hilto,132.0,2013-11-21,3789.01,0.69316,2626.4,Hilton Garden Inn,3,1.3785982447132406,Select Service,Focused Service
Hampton Inn Titusville (I-95) Kennedy Space Center,TIXFL,Hilto,86.0,2015-11-18,3719.45,0.58267,2167.22,Hampton Inn by Hilton,2,2.077141939363505,Select Service,Focused Service
Home2 Suites Birmingham Colonnade,BHMHT,Hilto,107.0,2018-05-14,3668.58,0.56093,2057.8,Home2 Suites by Hilton,3,1.6466455215988856,All Suites,Focused Service
Hampton Inn Jupiter/Juno Beach,PBIJB,Hilto,89.0,2016-12-27,3664.15,0.49415,1810.63,Hampton Inn by Hilton,2,1.97728439308704,Select Service,Focused Service
Hilton Garden Inn Cincinnati Blue Ash,CVGBO,Hilto,122.0,2018-09-28,3661.8,0.49454,1810.91,Hilton Garden Inn,3,1.4415200608195649,Select Service,Focused Service
Hilton Garden Inn Greenville,GSPGV,Hilto,120.0,2018-04-23,3611.85,0.58795,2123.6,Hilton Garden Inn,3,1.4455541360894455,Select Service,Focused Service
Hampton Inn & Suites Syracuse North Airport Area,SYRNA,Hilto,105.0,2018-06-01,3598.5,0.59668,2147.15,Hampton Inn & Suites by Hilton,3,1.6459555736076272,Select Service,Focused Service
Hampton Inn & Suites Asheville (I-26),AVLAP,Hilto,95.0,2014-10-13,3587.81,0.61356,2201.34,Hampton Inn & Suites by Hilton,2,1.8138097481764885,Select Service,Focused Service
Home2 Suites by Hilton Irving / DFW Airport North,DALIV,Hilto,93.0,2018-09-27,3581.0,0.63556,2275.94,Home2 Suites by Hilton,2,1.8492995900452422,All Suites,Focused Service
Hampton Inn & Suites Asheville Biltmore Area,AVLBA,Hilto,114.0,2018-09-19,3575.11,0.56639,2024.91,Hampton Inn & Suites by Hilton,3,1.5061577417243497,Select Service,Focused Service
Hilton Garden Inn Salina,SLNTC,Hilto,97.0,2018-07-22,3572.62,0.48144,1720.01,Hilton Garden Inn,2,1.7688906722162827,Select Service,Focused Service
Home2 Suites by Hilton La Crosse,LSEHT,Hilto,107.0,2018-12-26,3448.56,0.67088,2313.58,Home2 Suites by Hilton,3,1.5478893413705175,All Suites,Focused Service
Hampton Inn Orlando International Drive/Convention Center,MCOCC,Hilto,170.0,2018-01-29,3416.0,0.70087,2394.16,Hampton Inn by Hilton,4,0.9650611695094912,Select Service,Focused Service
Tru by Hilton Louisville Airport,SDFLA,Hilto,98.0,2018-10-11,3361.26,0.61456,2065.69,Tru by Hilton,2,1.6472591649331187,Select Service,Focused Service
"Hilton Garden Inn Beaumont, TX",BPTGI,Hilto,100.0,2015-09-07,3334.25,0.46471,1549.47,Hilton Garden Inn,3,1.601341875744419,Select Service,Focused Service
Tru by Hilton Lafayette,LFTRU,Hilto,98.0,2018-10-24,3320.45,0.60317,2002.78,Tru by Hilton,2,1.627259329597286,Select Service,Focused Service
Tru By Hilton Cedar Rapids Westdale,CIDRU,Hilto,95.0,2018-02-16,3318.93,0.67729,2247.88,Tru by Hilton,2,1.6778780335400685,Select Service,Focused Service
Hilton Garden Inn Houston NW Willowbrook,HOUHN,Hilto,171.0,2014-12-09,3240.85,0.68291,2213.21,Hilton Garden Inn,4,0.910224919376347,Select Service,Focused Service
Hampton Inn & Suites Glendale,LAXGL,Hilto,94.0,2017-08-14,3233.61,0.58372,1887.52,Hampton Inn & Suites by Hilton,2,1.652135589146786,Select Service,Focused Service
Homewood Suites by Hilton Trophy Club Fort Worth North,FTWTR,Hilto,110.0,2018-09-18,3215.91,0.60276,1938.43,Homewood Suites by Hilton,3,1.4040969692312526,All Suites,All Suites
Embassy Suites by Hilton Memphis,MEMPE,Hilto,220.0,2018-01-31,3168.25,0.68281,2163.32,Embassy Suites,5,0.6916440794000636,All Suites,All Suites
Hampton Inn & Suites Baton Rouge Downtown,BTRDN,Hilto,137.0,2015-03-13,3110.1,0.67418,2096.77,Hampton Inn & Suites by Hilton,3,1.090284121009653,Select Service,Focused Service
"Homewood Suites Lafayette Airport, LA",LFTKS,Hilto,129.0,2014-10-28,3076.22,0.54078,1663.56,Homewood Suites by Hilton,3,1.1452850245258128,All Suites,All Suites
Homewood Suites by Hilton Albany Crossgates Mall,ALBCM,Hilto,96.0,2018-10-03,3060.1,0.73953,2263.04,Homewood Suites by Hilton,2,1.5309122097565346,All Suites,All Suites
Hampton Inn Kennewick at Southridge,VSKTC,Hilto,80.0,2015-06-29,3038.65,0.52066,1582.11,Hampton Inn by Hilton,2,1.8242173992392516,Select Service,Focused Service
Tru by Hilton Auburn,CSGAA,Hilto,98.0,2018-03-29,3038.64,0.65784,1998.93,Tru by Hilton,2,1.4891521598842017,Select Service,Focused Service
Hilton Garden Inn Omaha West,OMAWE,Hilto,119.0,2015-03-17,3009.0,0.54238,1632.03,Hilton Garden Inn,3,1.214398234800125,Select Service,Focused Service
Hilton Garden Inn Knoxville West Cedar Bluff,TYSKH,Hilto,118.0,2014-09-22,2904.33,0.64639,1877.32,Hilton Garden Inn,3,1.1820881249133068,Select Service,Focused Service
La Quinta Inn & Suites Atlanta Airport North,6739,Wyndh,188.0,2016-10-04,2896.01,0.71322,2065.5,La Quinta Inn & Suites,4,0.7398234770929369,Other,Other
Hampton Inn & Suites Southwest/Sioux Falls,FSDSW,Hilto,93.0,2018-11-09,2895.28,0.52583,1522.43,Hampton Inn & Suites by Hilton,2,1.4951801499765958,Select Service,Focused Service
Homewood Suites Asheville Tunnel Road,AVLHW,Hilto,94.0,2014-10-31,2886.73,0.51241,1479.18,Homewood Suites by Hilton,2,1.4749055604286545,All Suites,All Suites
Home2 Suites by Hilton Hilton Head,HHHHT,Hilto,99.0,2018-11-01,2819.46,0.64101,1807.29,Home2 Suites by Hilton,2,1.3677812434872412,All Suites,Focused Service
Tru by Hilton Roanoke Hollins,ROARH,Hilto,82.0,2018-08-30,2807.27,0.63034,1769.54,Tru by Hilton,2,1.6442060168286776,Select Service,Focused Service
Hampton Inn Harrisburg West,HRBPA,Hilto,129.0,2015-04-30,2801.18,0.63837,1788.19,Hampton Inn by Hilton,3,1.0428868887794813,Select Service,Focused Service
Homewood Suites by Hilton Denver International Airport,DENIP,Hilto,117.0,2016-05-30,2796.64,0.60723,1698.19,Homewood Suites by Hilton,3,1.1479860329132237,All Suites,All Suites
Tru by Hilton Syracuse North Airport Area,SYRAA,Hilto,93.0,2018-06-22,2744.4,0.62056,1703.06,Tru by Hilton,2,1.4172627184920867,Select Service,Focused Service
Hampton Inn Rapid City,RAPHA,Hilto,82.0,2018-02-08,2728.07,0.6159,1680.22,Hampton Inn by Hilton,2,1.597818916003737,Select Service,Focused Service
Home2 Suites by Hilton Minneapolis - Eden Prarie,MSPEN,Hilto,102.0,2018-09-06,2717.25,0.60051,1631.73,Home2 Suites by Hilton,3,1.2794264553325843,All Suites,Focused Service
Tru by Hilton Sterling Heights Detroit,DTWSH,Hilto,98.0,2018-05-15,2703.38,0.61585,1664.88,Tru by Hilton,2,1.324850645679565,Select Service,Focused Service
TRU by Hilton York,THVPA,Hilto,106.0,2017-10-12,2696.75,0.54012,1456.56,Tru by Hilton,3,1.221857961724798,Select Service,Focused Service
Delta Colonial Hotel,RDLN01,Marri,100.0,2014-11-24,2694.45,0.64126,1727.84,Delta Hotels,3,1.294064817305106,Full Service,Classic Premium
Hilton Garden Inn Jackson/Clinton,JANCL,Hilto,107.0,2018-11-08,2664.68,0.59461,1584.45,Hilton Garden Inn,3,1.1960440793151896,Select Service,Focused Service
Hilton Garden Inn Memphis Wolfchase Galleria,MEMCW,Hilto,124.0,2015-03-07,2639.64,0.69906,1845.27,Hilton Garden Inn,3,1.0223719289026159,Select Service,Focused Service
Avid Hotel Oklahoma City - Quail Springs,OKCAV,IHG,87.0,2018-08-07,2623.61,0.54375,1426.58,Avid Hotels,2,1.448324661966861,All Suites,Focused Service
Hampton Inn & Suites Trophy Club,FTWTC,Hilto,94.0,2015-03-11,2621.35,0.66831,1751.87,Hampton Inn & Suites by Hilton,2,1.33931600490162,Select Service,Focused Service
Hilton Philadelphia City Avenue,PHLPH,Hilto,209.0,2015-09-03,2610.4,0.65197,1701.91,Full Services,5,0.5998555419905314,Other,Other
Hampton Inn & Suites Blythe,BLHBL,Hilto,81.0,2016-03-30,2597.67,0.57765,1500.55,Hampton Inn & Suites by Hilton,2,1.5402274561032772,Select Service,Focused Service
Hampton Inn & Suites Riverton,RIWWY,Hilto,89.0,2018-05-03,2576.45,0.56416,1453.52,Hampton Inn & Suites by Hilton,2,1.390329100765281,Select Service,Focused Service
Tru by Hilton Wichita Northeast,MCIWI,Hilto,98.0,2018-06-22,2572.07,0.60947,1567.59,Tru by Hilton,2,1.2604993009614034,Select Service,Focused Service
"Tru by Hilton Jackson, MI",LANJA,Hilto,93.0,2018-08-20,2557.47,0.65677,1679.68,Tru by Hilton,2,1.320728350335941,Select Service,Focused Service
Hampton Inn Chicago McCormick Place,CHIMC,Hilto,95.0,2018-08-07,2533.0,0.69274,1754.72,Hampton Inn by Hilton,2,1.2805527862765993,Select Service,Focused Service
Home2 Suites by Hilton Fort Worth Northlake,DFWNL,Hilto,104.0,2018-09-26,2527.2,0.6362,1607.81,Home2 Suites by Hilton,3,1.167057286663849,All Suites,Focused Service
Homewood Suites Reading,RDGPA,Hilto,119.0,2015-05-14,2506.24,0.6761,1694.48,Homewood Suites by Hilton,3,1.0114900073065687,All Suites,All Suites
Tru By Hilton Tallahassee Central,TLHCN,Hilto,90.0,2018-04-04,2485.43,0.63412,1576.06,Tru by Hilton,2,1.3263096442583127,Select Service,Focused Service
Home2 Suites by Hilton Dallas Grand Prairie,DFWGP,Hilto,96.0,2018-10-17,2461.37,0.66297,1631.81,Home2 Suites by Hilton,2,1.2313785123781713,All Suites,Focused Service
Hampton Inn & Suites by Hilton Snellville,ATLSV,Hilto,100.0,2018-12-20,2456.6,0.66747,1639.71,Hampton Inn & Suites by Hilton,3,1.1798324816536672,Select Service,Focused Service
Tru by Hilton Williamsville Buffalo Airport,BUFRU,Hilto,79.0,2018-04-04,2434.49,0.53754,1308.64,Tru by Hilton,1,1.4800173432360648,Select Service,Focused Service
Tru by Hilton Lawrence,LWCNE,Hilto,82.0,2018-12-19,2431.08,0.58724,1427.62,Tru by Hilton,2,1.4238731448673843,Select Service,Focused Service
Hilton Garden Inn Mobile West I-65/Airport Blvd.,MOBWS,Hilto,101.0,2017-02-10,2413.38,0.64863,1565.39,Hilton Garden Inn,3,1.1475991991560934,Select Service,Focused Service
Hilton Garden Inn Omaha East Council Bluffs,OMAEA,Hilto,153.0,2015-03-20,2374.32,0.55035,1306.71,Hilton Garden Inn,4,0.7453044613549881,Select Service,Focused Service
Hilton Garden Inn Bristol,TRIGI,Hilto,104.0,2015-04-03,2340.09,0.64895,1518.59,Hilton Garden Inn,3,1.0806501606320063,Select Service,Focused Service
Homewood Suites Denver Tech Center,DENHW,Hilto,113.0,2013-10-09,2233.82,0.68921,1539.57,Homewood Suites by Hilton,3,0.9494140020013254,All Suites,All Suites
Hotel MdR Marina Del Ray - a DoubleTree by Hilton,LAXMA,Hilto,283.0,2018-01-23,2218.97,0.57168,1268.53,DoubleTree by Hilton,5,0.3765744895793861,Full Service,Full Service
"Hilton Garden Inn Fredericton, New Brunswick",YFCNW,Hilto,110.0,2018-09-18,2209.5,0.53646,1185.3,Hilton Garden Inn,3,0.9646887672591749,Select Service,Focused Service
Hampton Inn Waterloo,ALOIA,Hilto,101.0,2018-01-30,2205.32,0.55376,1221.21,Hampton Inn by Hilton,3,1.0486634785582527,Select Service,Focused Service
Homewood Suites Poplar,MEMPO,Hilto,140.0,2013-12-16,2143.58,0.50879,1090.63,Homewood Suites by Hilton,3,0.7353558667098452,All Suites,All Suites
Hampton Inn & Suites Lincoln Northeast I-80,LNKNH,Hilto,83.0,2015-05-19,2128.9,0.70326,1497.17,Hampton Inn & Suites by Hilton,2,1.2318648706324895,Select Service,Focused Service
TRU by Hilton Sumter,SSCSC,Hilto,90.0,2018-08-07,2093.94,0.62208,1302.59,Tru by Hilton,2,1.117397318169593,Select Service,Focused Service
Home2Suites KCI Airport,MCIKA,Hilto,91.0,2018-06-12,2088.24,0.51612,1077.78,Home2 Suites by Hilton,2,1.1021099390869242,All Suites,Focused Service
Hampton Inn Denver-Gateway Park,DENAP,Hilto,115.0,2016-05-30,2052.15,0.66568,1366.08,Hampton Inn by Hilton,3,0.8570322457782135,Select Service,Focused Service
Candlewood Suites - Fort Collins,FCLCW,IHG,83.0,2018-12-13,2037.0,0.64371,1311.24,Candlewood Suites,2,1.1786879334296496,All Suites,All Suites
Hampton Inn & Suites Phenix City- Columbus Area,CSGPC,Hilto,81.0,2018-09-19,2028.58,0.57002,1156.34,Hampton Inn & Suites by Hilton,2,1.2027988978207338,Select Service,Focused Service
Tru by Hilton Shepherdsville Louisville South,SDFRU,Hilto,83.0,2018-12-06,2008.6,0.64961,1304.81,Tru by Hilton,2,1.1622545817804586,Select Service,Focused Service
Hampton Inn Charleston Southridge,CRWSO,Hilto,139.0,2015-06-17,1994.05,0.4492,895.73,Hampton Inn by Hilton,3,0.6889808397643508,Select Service,Focused Service
Hampton Inn & Suites Los Angeles Burbank Airport,LAXBK,Hilto,99.0,2014-11-18,1947.29,0.67467,1313.77,Hampton Inn & Suites by Hilton,2,0.9446726456946613,Select Service,Focused Service
Hilton Garden Inn Fort Myers Airport FGCU,RSWFM,Hilto,164.0,2014-07-12,1929.36,0.56169,1083.71,Hilton Garden Inn,4,0.5650089447449973,Select Service,Focused Service
"Hampton Inn Middletown, NY",MLTNY,Hilto,127.0,2015-05-14,1895.9,0.61696,1169.7,Hampton Inn by Hilton,3,0.7169644242850172,Select Service,Focused Service
Hampton Inn & Suites Palm Desert,PLMHS,Hilto,88.0,2014-10-30,1890.49,0.59397,1122.9,Hampton Inn & Suites by Hilton,2,1.0317574494318837,Select Service,Focused Service
Hilton Garden Inn Saskatoon Downtown,YXESD,Hilto,180.0,2014-10-08,1887.43,0.61084,1152.91,Hilton Garden Inn,4,0.5035982932254112,Select Service,Focused Service
Hilton Garden Inn Kennett Square,PHLKS,Hilto,92.0,2015-07-22,1843.27,0.65301,1203.67,Hilton Garden Inn,2,0.9622480250442266,Select Service,Focused Service
Homewood Suites Philadelphia Valley Forge,PHLHW,Hilto,123.0,2015-06-21,1841.87,0.6911,1272.91,Homewood Suites by Hilton,3,0.7191835807780599,All Suites,All Suites
"Home2 Suites by Hilton Columbus, GA",CSGBP,Hilto,81.0,2018-11-20,1816.35,0.62077,1127.54,Home2 Suites by Hilton,2,1.0769621006106191,All Suites,Focused Service
Homewood Suites Durham Chapel Hill (I-40),RDUHW,Hilto,96.0,2015-08-11,1777.59,0.51701,919.03,Homewood Suites by Hilton,2,0.8892958514235216,All Suites,All Suites
Hampton Inn & Suites Tarpon Springs,TPATS,Hilto,84.0,2015-08-03,1763.21,0.54579,962.35,Hampton Inn & Suites by Hilton,2,1.008116342552697,Select Service,Focused Service
Hilton Garden Inn Cedar Falls,ALOCF,Hilto,113.0,2018-01-12,1703.65,0.5985,1019.64,Hilton Garden Inn,3,0.7240821393440645,Select Service,Focused Service
Hampton Inn & Suites DuPont,SEADP,Hilto,115.0,2015-08-13,1700.75,0.63777,1084.69,Hampton Inn & Suites by Hilton,3,0.7102782896022691,Select Service,Focused Service
Tru by Hilton Staunton,SHDST,Hilto,90.0,2018-11-09,1688.62,0.67481,1139.5,Tru by Hilton,2,0.90110483557673,Select Service,Focused Service
Homewood Suites by Hilton Ottawa Downtown,YOWQS,Hilto,171.0,2018-12-31,1632.4,0.51256,836.71,Homewood Suites by Hilton,4,0.45847575740622026,All Suites,All Suites
Homewood Suites Reno,RNOHW,Hilto,96.0,2015-08-09,1601.93,0.61169,979.88,Homewood Suites by Hilton,2,0.8014163576926525,All Suites,All Suites
Home2 Suites by Hilton Plymouth Minneapolis,MSPPL,Hilto,102.0,2018-08-22,1563.25,0.59857,935.72,Home2 Suites by Hilton,3,0.7360616087215613,All Suites,Focused Service
Hampton Inn & Suites Fort Lauderdale Miramar,FLLMM,Hilto,122.0,2015-07-23,1528.5,0.70247,1073.73,Hampton Inn & Suites by Hilton,3,0.6017159355952549,Select Service,Focused Service
Hampton Inn Magnolia,AGOSN,Hilto,68.0,2018-04-03,1521.53,0.61756,939.64,Hampton Inn by Hilton,1,1.0746264060624826,Select Service,Focused Service
Homewood Suites by Hilton Syracuse/Liverpool,SYRHW,Hilto,102.0,2018-06-07,1521.44,0.59419,904.03,Homewood Suites by Hilton,3,0.7163752272338604,All Suites,All Suites
Hampton Inn Eufaula,EUFHX,Hilto,78.0,2018-09-24,1515.09,0.61685,934.58,Hampton Inn by Hilton,1,0.9328884797148521,Select Service,Focused Service
Hilton Garden Inn Orange Beach Beachfront,ORBHH,Hilto,137.0,2015-10-23,1346.75,0.57663,776.58,Hilton Garden Inn,3,0.4721199125332788,Select Service,Focused Service
Hampton Inn & Suites Red Deer,YQFRD,Hilto,110.0,2014-12-15,1323.21,0.4938,653.4,Hampton Inn & Suites by Hilton,3,0.5777261026137193,Select Service,Focused Service
Home2 Suites by Hilton Chicago McCormick Place,CHIMI,Hilto,95.0,2018-08-07,1304.75,0.73204,955.13,Home2 Suites by Hilton,2,0.6596135996424765,All Suites,Focused Service
