Property Name,Property Code,Brand,#Rooms,Activation Date,Revenue,Profit Margin,Gross Profit,Flag,Size Subset,SPOR,Group,Type
DoubleTree Annapolis,ANPDT,Hilto,224.0,2016-08-05,7583.16,0.65372,4957.25,DoubleTree by Hilton,5,1.6258785519433114,Full Service,Full Service
Hampton Inn & Suites LAX El Segundo,LAXEL,Hilto,171.0,2018-06-22,7580.52,0.67838,5142.5,Hampton Inn & Suites by Hilton,4,2.129064352201054,Select Service,Focused Service
Embassy Suites Minneapolis Airport,MSPAP,Hilto,310.0,2018-05-09,7416.45,0.6544,4853.31,Embassy Suites,5,1.1490006655619411,All Suites,All Suites
Embassy Suites Lombard,CHILM,Hilto,262.0,2016-09-14,7244.72,0.61696,4469.71,Embassy Suites,5,1.3280248901830365,All Suites,All Suites
Hilton Garden Inn Chicago North Shore/Evanston,ORDEV,Hilto,178.0,2018-11-09,7211.72,0.64807,4673.68,Hilton Garden Inn,4,1.9458293742496444,Select Service,Focused Service
Hilton Garden Inn Jacksonville Downtown Southbank,JAXSB,Hilto,123.0,2018-12-17,7008.25,0.65381,4582.06,Hilton Garden Inn,3,2.7364680080504264,Select Service,Focused Service
Hilton Garden Inn Washington DC Bethesda,WASBT,Hilto,216.0,2015-04-14,6693.85,0.71084,4758.24,Hilton Garden Inn,5,1.4883604668371448,Select Service,Focused Service
Crowne Plaza Ventura Beach,VNTCA,IHG,235.0,2018-10-03,4996.72,0.56355,2815.91,Crowne Plaza,5,1.0211817678695365,Full service,Full service
Hilton Garden Inn Houston Hobby Airport,HOUMR,Hilto,136.0,2018-11-20,6515.74,0.60585,3947.59,Hilton Garden Inn,3,2.300968846831006,Select Service,Focused Service
Hilton Garden Inn Los Angeles Montebello,LGBMB,Hilto,121.0,2015-03-30,6436.6,0.71057,4573.68,Hilton Garden Inn,3,2.5548008473082784,Select Service,Focused Service
Homewood Suites by Hilton Washington DC NoMa Union Station,DCANE,Hilto,114.0,2018-09-13,6387.58,0.64931,4147.53,Homewood Suites by Hilton,3,2.6910229525479274,All Suites,All Suites
Embassy Suites Seattle - Bellevue,SEABL,Hilto,240.0,2016-03-09,6341.23,0.57944,3674.35,Embassy Suites,5,1.268960678654218,All Suites,All Suites
Hampton Inn Washington DC NoMa Union Station,DCANY,Hilto,125.0,2018-09-05,6291.92,0.64361,4049.56,Hampton Inn by Hilton,3,2.4174587927921003,Select Service,Focused Service
Crowne Plaza Springfield,SPICC,IHG,288.0,2017-07-31,5095.5,0.59554,3034.57,Crowne Plaza,5,0.8497285671290071,Full service,Full service
Tru by Hilton Chicopee Springfield,BDLRU,Hilto,108.0,2018-06-13,5887.96,0.60841,3582.27,Tru by Hilton,3,2.6183457634450833,Select Service,Focused Service
Tru by Hilton Raleigh Durham Airport,RDUAT,Hilto,106.0,2018-08-20,5867.84,0.67781,3977.26,Tru by Hilton,3,2.6586324361276494,Select Service,Focused Service
DoubleTree Suites Salt Lake City Downtown,SLCWS,Hilto,241.0,2016-03-04,5816.22,0.64816,3769.82,DoubleTree by Hilton,5,1.1590700496627584,Full Service,Full Service
Hampton Inn Indianapolis Dwtn Across from Circle Centre,INDDT,Hilto,180.0,2018-01-16,5739.79,0.57858,3320.93,Hampton Inn by Hilton,4,1.5314731923686085,Select Service,Focused Service
Hilton Garden Inn New York Midtown Park Ave,NYCET,Hilto,232.0,2015-10-15,5675.82,0.63228,3588.69,Hilton Garden Inn,5,1.1749693289329515,Select Service,Focused Service
Tru by Hilton Pigeon Forge,TYSPF,Hilto,102.0,2018-06-18,5518.98,0.59895,3305.61,Tru by Hilton,3,2.5986306075817187,Select Service,Focused Service
Homewood Suites by Hilton Ft.Lauderdale Airport-Cruise Port,FLLAR,Hilto,124.0,2018-08-29,5495.2,0.50718,2787.07,Homewood Suites by Hilton,3,2.1283728931618158,All Suites,All Suites
Doubletree by Hilton Denver Tech Center,DENEW,Hilto,305.0,2016-11-22,5389.34,0.69722,3757.55,DoubleTree by Hilton,5,0.8486363782377316,Full Service,Full Service
Crowne Plaza Palo Alto,SFOCA,IHG,195.0,2017-06-29,5101.24,0.6746,3441.28,Crowne Plaza,4,1.2563974491972338,Full service,Full service
Tru By Hilton Charlotte Ayrsley,CLTCA,Hilto,92.0,2018-04-27,5357.7,0.59389,3181.88,Tru by Hilton,2,2.796896951493516,Select Service,Focused Service
Hilton Garden Inn Abilene,ABIAB,Hilto,123.0,2015-03-19,5329.32,0.60987,3250.18,Hilton Garden Inn,3,2.08090660074388,Select Service,Focused Service
Hampton Inn & Suites Syracuse North Airport Area,SYRNA,Hilto,105.0,2018-06-01,5021.56,0.59665,2996.12,Hampton Inn & Suites by Hilton,3,2.296863879451193,Select Service,Focused Service
Tru By Hilton Lake Charles,LCHRU,Hilto,98.0,2018-05-23,4797.37,0.69915,3354.06,Tru by Hilton,2,2.3510563598398204,Select Service,Focused Service
Tru by Hilton Fayetteville I-95,FAYRU,Hilto,109.0,2018-12-20,4745.89,0.66831,3171.71,Tru by Hilton,3,2.0911109246819555,Select Service,Focused Service
Hampton Inn Orlando International Drive/Convention Center,MCOCC,Hilto,170.0,2018-01-29,4741.82,0.6732,3192.2,Hampton Inn by Hilton,4,1.3396212982445828,Select Service,Focused Service
Tru by Hilton Meridian Boise West,BOIMW,Hilto,92.0,2018-04-21,4735.71,0.63159,2991.01,Tru by Hilton,2,2.472197559056565,Select Service,Focused Service
Hampton Inn & Suites Mount Vernon Belvoir Alexandria South Area,WASFB,Hilto,131.0,2014-12-30,4675.5,0.55688,2603.7,Hampton Inn & Suites by Hilton,3,1.7141257009382798,Select Service,Focused Service
Hilton Garden Inn New Orleans French Quarter CBD,MSYOR,Hilto,155.0,2016-01-16,4594.32,0.66363,3048.95,Hilton Garden Inn,4,1.4235589096682475,Select Service,Focused Service
Embassy Suites Seattle North Lynnwood,SEALW,Hilto,240.0,2018-02-23,4583.24,0.57621,2640.92,Embassy Suites,5,0.9171645470729114,All Suites,All Suites
The Saratoga Hilton (Gift Shop),ALBSA:Gift Shop,Hilto,245.0,2017-07-17,4551.8,0.60979,2775.66,Hilton Hotels & Resorts,5,0.8922837587026973,Full Service,Full Service
Embassy Suites Dallas Love Field,DALLF,Hilto,248.0,2016-11-02,4514.99,0.61013,2754.72,Embassy Suites,5,0.874361472639455,All Suites,All Suites
Tru by Hilton Fort Wayne North,FWARU,Hilto,92.0,2018-06-27,4482.25,0.57141,2561.2,Tru by Hilton,2,2.339883039519161,Select Service,Focused Service
"Hampton Inn & Suites Roseburg, OR",OTHRO,Hilto,90.0,2018-04-22,4476.35,0.61635,2759.02,Hampton Inn & Suites by Hilton,2,2.3887320005293646,Select Service,Focused Service
Hilton Garden Inn Cincinnati Midtown,CVGMD,Hilto,120.0,2018-10-17,4425.75,0.71143,3148.6,Hilton Garden Inn,3,1.7712975948053944,Select Service,Focused Service
Homewood Suites San Diego Airport Liberty Station,SANLS,Hilto,150.0,2014-10-21,4360.39,0.55806,2433.34,Homewood Suites by Hilton,4,1.396111089765756,All Suites,All Suites
Crowne Plaza Baltimore,IHG-BALWB,IHG,385.0,2018-06-08,5245.4,0.62115,3258.17,Crowne Plaza,5,0.6543404726061197,Full service,Full service
"Hilton Garden Inn Seattle/Bothell, WA",SEABO,Hilto,128.0,2017-05-22,4348.35,0.53685,2334.42,Hilton Garden Inn,3,1.6315501390383063,Select Service,Focused Service
TRU by Hilton Syracuse - Camillus,SYRRU,Hilto,92.0,2018-07-19,4328.58,0.62817,2719.08,Tru by Hilton,2,2.259662206972358,Select Service,Focused Service
Hilton Garden Inn Denver Airport,DENAH,Hilto,157.0,2013-10-10,4273.27,0.63418,2710.02,Hilton Garden Inn,4,1.307213674971043,Select Service,Focused Service
Tru by Hilton Madison West,MSNCB,Hilto,106.0,2018-04-11,4193.82,0.59248,2484.77,Tru by Hilton,3,1.9001584711377368,Select Service,Focused Service
Hampton Inn & Suites Hood River,PDXHR,Hilto,88.0,2018-09-17,4188.6,0.55684,2332.39,Hampton Inn & Suites by Hilton,2,2.285978372110082,Select Service,Focused Service
Hilton Garden Inn San Antonio Live Oak Convention Center,SATLI,Hilto,138.0,2017-06-27,4178.15,0.64016,2674.69,Hilton Garden Inn,3,1.4540885078650205,Select Service,Focused Service
Hilton Garden Inn Tampa - Wesley Chapel,TPAWL,Hilto,124.0,2018-10-04,4137.12,0.65551,2711.91,Hilton Garden Inn,3,1.602368260255789,Select Service,Focused Service
Hampton Inn Asheville-Tunnel Rd.,AVLTU,Hilto,120.0,2016-05-27,4015.9,0.55465,2227.41,Hampton Inn by Hilton,3,1.6072652117672672,Select Service,Focused Service
Hilton Garden Inn Omaha East Council Bluffs,OMAEA,Hilto,153.0,2015-03-20,3999.99,0.56948,2277.91,Hilton Garden Inn,4,1.2556059808178082,Select Service,Focused Service
Hilton Garden Inn Greenville,GSPGV,Hilto,120.0,2018-04-23,3987.44,0.60312,2404.9,Hilton Garden Inn,3,1.5958747966854931,Select Service,Focused Service
Hampton Inn & Suites Asheville Biltmore Area,AVLBA,Hilto,114.0,2018-09-19,3971.88,0.5676,2254.43,Hampton Inn & Suites by Hilton,3,1.6733129361614356,Select Service,Focused Service
Hilton Garden Inn Seattle Issaquah,SEAIS,Hilto,179.0,2015-11-03,3933.44,0.64339,2530.73,Hilton Garden Inn,4,1.0553715919845161,Select Service,Focused Service
Hampton Inn Jupiter/Juno Beach,PBIJB,Hilto,89.0,2016-12-27,3889.09,0.50256,1954.5,Hampton Inn by Hilton,2,2.098668711791514,Select Service,Focused Service
Hampton Inn & Suites Columbia South,BALCO,Hilto,124.0,2015-06-30,3886.55,0.5791,2250.7,Hampton Inn & Suites by Hilton,3,1.505318763269409,Select Service,Focused Service
Tru by Hilton San Antonio Downtown,SATDO,Hilto,94.0,2018-04-25,3869.04,0.53719,2078.4,Tru by Hilton,2,1.9767933300034575,Select Service,Focused Service
Tru by Hilton Salt Lake City Airport,SLCRU,Hilto,95.0,2018-03-28,3799.19,0.57749,2193.98,Tru by Hilton,2,1.9206724595713358,Select Service,Focused Service
Hilton Garden Inn Riverhead,ISPRH,Hilto,114.0,2018-05-24,3789.48,0.64957,2461.53,Hilton Garden Inn,3,1.5964696580271902,Select Service,Focused Service
Tru By Hilton Cedar Rapids Westdale,CIDRU,Hilto,95.0,2018-02-16,3773.54,0.68408,2581.41,Tru by Hilton,2,1.9077051563861818,Select Service,Focused Service
Tru by Hilton North Platte,LBFRU,Hilto,98.0,2018-05-14,3759.53,0.57871,2175.67,Tru by Hilton,2,1.8424401112502478,Select Service,Focused Service
Hilton Richmond Downtown,RICRD (RICDT),Hilto,250.0,2015-10-19,3744.2,0.73649,2757.58,Full Services,5,0.7192915049756021,Other,Other
Homewood Suites by Hilton Odessa,MAFOD,Hilto,121.0,2017-10-09,3701.43,0.6426,2378.55,Homewood Suites by Hilton,3,1.4691633005394586,All Suites,All Suites
Tru by Hilton Louisville Airport,SDFLA,Hilto,98.0,2018-10-11,3647.85,0.62149,2267.11,Tru by Hilton,2,1.787708878456673,Select Service,Focused Service
Hilton Garden Inn Cincinnati Blue Ash,CVGBO,Hilto,122.0,2018-09-28,3599.49,0.55209,1987.26,Hilton Garden Inn,3,1.4169908361241506,Select Service,Focused Service
Embassy Suites by Hilton Arcadia,LAXHD,Hilto,191.0,2018-06-08,3489.16,0.67383,2351.1,Embassy Suites,4,0.8773510874832557,All Suites,All Suites
Hilton Garden Inn Orlando Airport,ORLAH,Hilto,132.0,2013-11-21,3461.56,0.69741,2414.11,Hilton Garden Inn,3,1.2594584178900463,Select Service,Focused Service
Crowne Plaza Springfield,SPICC,IHG,288.0,2017-07-31,5314.75,0.59391,3156.5,Crowne Plaza,5,0.8862908256596782,Full service,Full service
Hampton Inn Titusville (I-95) Kennedy Space Center,TIXFL,Hilto,86.0,2015-11-18,3397.85,0.5972,2029.18,Hampton Inn by Hilton,2,1.8975431148869553,Select Service,Focused Service
Homewood Suites Harrisburg West Hershey Area,HARHW,Hilto,116.0,2015-06-13,3362.67,0.60422,2031.78,Homewood Suites by Hilton,3,1.3922337612267366,All Suites,All Suites
Hilton Garden Inn Portland Downtown Waterfront,PWMDH,Hilto,120.0,2018-01-31,3326.05,0.50012,1663.42,Hilton Garden Inn,3,1.331169714783366,Select Service,Focused Service
Hilton Garden Inn Dallas Arlington,DFWAR,Hilto,132.0,2015-03-11,3312.49,0.67781,2245.24,Hilton Garden Inn,3,1.2052205984228497,Select Service,Focused Service
Home2 Suites by Hilton Irving / DFW Airport North,DALIV,Hilto,93.0,2018-09-27,3302.12,0.64065,2115.51,Home2 Suites by Hilton,2,1.7052804139291244,All Suites,Focused Service
Hilton Garden Inn Salina,SLNTC,Hilto,97.0,2018-07-22,3294.5,0.46809,1542.11,Hilton Garden Inn,2,1.6311867256009718,Select Service,Focused Service
DoubleTree by Hilton Hotel San Francisco Airport,SFOAO,Hilto,395.0,2018-05-24,3289.59,0.66378,2183.56,DoubleTree by Hilton,5,0.3999729103127083,Full Service,Full Service
Hampton Inn & Suite Yonkers Westchester,LGAYW,Hilto,150.0,2016-12-14,3276.52,0.60723,1989.59,Hampton Inn & Suites by Hilton,4,1.0490772403017379,Select Service,Focused Service
Tru By Hilton Tallahassee Central,TLHCN,Hilto,90.0,2018-04-04,3238.17,0.58621,1898.24,Tru by Hilton,2,1.727997208027561,Select Service,Focused Service
Embassy Suites by Hilton Memphis,MEMPE,Hilto,220.0,2018-01-31,3235.0,0.6728,2176.5,Embassy Suites,5,0.7062159226258046,All Suites,All Suites
Tru By Hilton St. Charles St. Louis,STLMO,Hilto,87.0,2018-06-21,3213.49,0.49381,1586.86,Tru by Hilton,2,1.773959093761606,Select Service,Focused Service
Home2 Suites Parc Lafayette,LFTHT,Hilto,106.0,2016-08-03,3212.65,0.55609,1786.53,Home2 Suites by Hilton,3,1.4556047022286724,All Suites,Focused Service
Tru by Hilton Auburn,CSGAA,Hilto,98.0,2018-03-29,3163.45,0.66908,2116.59,Tru by Hilton,2,1.5503180370776655,Select Service,Focused Service
Hilton Garden Inn Sun Prairie Madison,MSNSP,Hilto,124.0,2018-09-10,3161.58,0.6035,1908.0,Hilton Garden Inn,3,1.2245270730023536,Select Service,Focused Service
Tru by Hilton Bowling Green,BWGRU,Hilto,88.0,2018-07-02,3158.48,0.5919,1869.51,Tru by Hilton,2,1.7237781045557585,Select Service,Focused Service
Hampton Inn York,YRKPA,Hilto,144.0,2015-04-28,3081.15,0.72429,2231.65,Hampton Inn by Hilton,3,1.0276287605179237,Select Service,Focused Service
Hilton Garden Inn Knoxville West Cedar Bluff,TYSKH,Hilto,118.0,2014-09-22,3040.01,0.63876,1941.83,Hilton Garden Inn,3,1.2373110908945273,Select Service,Focused Service
Hampton Inn Oneonta,ONHNJ,Hilto,106.0,2014-12-08,3025.6,0.53421,1616.31,Hampton Inn by Hilton,3,1.3708550844514875,Select Service,Focused Service
Tru by Hilton Lafayette,LFTRU,Hilto,98.0,2018-10-24,2972.93,0.62481,1857.53,Tru by Hilton,2,1.4569495335691425,Select Service,Focused Service
Tru By Hilton Cheyenne,CYSND,Hilto,100.0,2017-08-14,2935.6,0.55602,1632.24,Tru by Hilton,3,1.4098820455680636,Select Service,Focused Service
Hilton Philadelphia City Avenue,PHLPH,Hilto,209.0,2015-09-03,2911.05,0.65224,1898.69,Full Services,5,0.6689432560188233,Other,Other
Hampton Inn & Suites Palm Desert,PLMHS,Hilto,88.0,2014-10-30,2859.25,0.5992,1713.25,Hampton Inn & Suites by Hilton,2,1.5604697656629305,Select Service,Focused Service
Hilton Garden Inn Ottawa Downtown,YOWCD,Hilto,175.0,2018-12-31,2856.0,0.64504,1842.23,Hilton Garden Inn,4,0.783801436969301,Select Service,Focused Service
Hilton Garden Inn Charlotte/Ayrsley,CLTAY,Hilto,120.0,2018-09-27,2845.81,0.73275,2085.26,Hilton Garden Inn,3,1.1389654653500851,Select Service,Focused Service
Hilton Garden Inn Jackson/Clinton,JANCL,Hilto,107.0,2018-11-08,2842.69,0.59012,1677.54,Hilton Garden Inn,3,1.2759440322397049,Select Service,Focused Service
La Quinta Inn & Suites Atlanta Airport North,6739,Wyndh,188.0,2016-10-04,2839.99,0.68064,1933.0,La Quinta Inn & Suites,4,0.7255124383925365,Other,Other
Hampton Inn Chicago McCormick Place,CHIMC,Hilto,95.0,2018-08-07,2833.75,0.70736,2004.49,Hampton Inn by Hilton,2,1.4325963119270877,Select Service,Focused Service
Homewood Suites by Hilton Trophy Club Fort Worth North,FTWTR,Hilto,110.0,2018-09-18,2779.65,0.61989,1723.09,Homewood Suites by Hilton,3,1.2136216935559925,All Suites,All Suites
Hampton Inn & Suites Los Angeles Burbank Airport,LAXBK,Hilto,99.0,2014-11-18,2735.7,0.68225,1866.43,Hampton Inn & Suites by Hilton,2,1.3271474494435265,Select Service,Focused Service
Hampton Inn & Suites Asheville (I-26),AVLAP,Hilto,95.0,2014-10-13,2688.08,0.60393,1623.41,Hampton Inn & Suites by Hilton,2,1.3589531518888278,Select Service,Focused Service
Tru by Hilton Deadwood,RAPSD,Hilto,108.0,2018-06-28,2683.22,0.65052,1745.48,Tru by Hilton,3,1.1932142404824617,Select Service,Focused Service
Hilton Garden Inn Washington DC Downtown,DCACH,Hilto,300.0,2015-09-29,2660.31,0.71003,1888.89,Hilton Garden Inn,5,0.42588946094440383,Select Service,Focused Service
Homewood Suites Reading,RDGPA,Hilto,119.0,2015-05-14,2638.69,0.69018,1821.16,Homewood Suites by Hilton,3,1.06494532342464,All Suites,All Suites
Homewood Suites Durham Chapel Hill (I-40),RDUHW,Hilto,96.0,2015-08-11,2614.24,0.52662,1376.72,Homewood Suites by Hilton,2,1.3078565848285753,All Suites,All Suites
Home2 Suites by Hilton Dallas Grand Prairie,DFWGP,Hilto,96.0,2018-10-17,2541.24,0.65232,1657.7,Home2 Suites by Hilton,2,1.2713360164444614,All Suites,Focused Service
Home2Suites KCI Airport,MCIKA,Hilto,91.0,2018-06-12,2526.0,0.47575,1201.75,Home2 Suites by Hilton,2,1.3331464324663693,All Suites,Focused Service
Hilton Garden Inn Mobile West I-65/Airport Blvd.,MOBWS,Hilto,101.0,2017-02-10,2502.35,0.67195,1681.45,Hilton Garden Inn,3,1.1899057985100772,Select Service,Focused Service
Home2 Suites by Hilton Hilton Head,HHHHT,Hilto,99.0,2018-11-01,2490.91,0.57291,1427.07,Home2 Suites by Hilton,2,1.2083945071803832,All Suites,Focused Service
TRU by Hilton Sumter,SSCSC,Hilto,90.0,2018-08-07,2458.32,0.60986,1499.22,Tru by Hilton,2,1.3118428298817895,Select Service,Focused Service
"Homewood Suites Lafayette Airport, LA",LFTKS,Hilto,129.0,2014-10-28,2429.92,0.53363,1296.69,Homewood Suites by Hilton,3,0.9046657868409161,All Suites,All Suites
Avid Hotel Oklahoma City - Quail Springs,OKCAV,IHG,87.0,2018-08-07,2422.79,0.51505,1247.87,Avid Hotels,2,1.3374649844171547,All Suites,Focused Service
Homewood Suites Asheville Tunnel Road,AVLHW,Hilto,94.0,2014-10-31,2395.58,0.498,1193.0,Homewood Suites by Hilton,2,1.22396423027151,All Suites,All Suites
Tru by Hilton Staunton,SHDST,Hilto,90.0,2018-11-09,2387.07,0.73088,1744.66,Tru by Hilton,2,1.273821416221616,Select Service,Focused Service
Hampton Inn Kennewick at Southridge,VSKTC,Hilto,80.0,2015-06-29,2386.15,0.53512,1276.87,Hampton Inn by Hilton,2,1.4324967821877281,Select Service,Focused Service
Hilton Garden Inn Memphis Wolfchase Galleria,MEMCW,Hilto,124.0,2015-03-07,2370.0,0.69099,1637.65,Hilton Garden Inn,3,0.9179363365834735,Select Service,Focused Service
Hampton Inn & Suites by Hilton Snellville,ATLSV,Hilto,100.0,2018-12-20,2357.43,0.63354,1493.53,Hampton Inn & Suites by Hilton,3,1.1322040573250853,Select Service,Focused Service
Hilton Garden Inn Saskatoon Downtown,YXESD,Hilto,180.0,2014-10-08,2283.31,0.61408,1402.13,Hilton Garden Inn,4,0.6092257826274423,Select Service,Focused Service
Hampton Inn & Suites Southwest/Sioux Falls,FSDSW,Hilto,93.0,2018-11-09,2231.32,0.55312,1234.18,Hampton Inn & Suites by Hilton,2,1.1522980064953225,Select Service,Focused Service
Hampton Inn & Suites Phenix City- Columbus Area,CSGPC,Hilto,81.0,2018-09-19,2217.77,0.59076,1310.17,Hampton Inn & Suites by Hilton,2,1.3149746678069827,Select Service,Focused Service
Hampton Inn & Suites Glendale,LAXGL,Hilto,94.0,2017-08-14,2216.08,0.59985,1329.31,Hampton Inn & Suites by Hilton,2,1.1322530040408116,Select Service,Focused Service
Home2 Suites Birmingham Colonnade,BHMHT,Hilto,107.0,2018-05-14,2207.96,0.57689,1273.76,Home2 Suites by Hilton,3,0.9910448854514486,All Suites,Focused Service
Hampton Inn Harrisburg West,HRBPA,Hilto,129.0,2015-04-30,2190.27,0.6393,1400.25,Hampton Inn by Hilton,3,0.8154434437940563,Select Service,Focused Service
Tru by Hilton Syracuse North Airport Area,SYRAA,Hilto,93.0,2018-06-22,2189.01,0.61992,1357.01,Tru by Hilton,2,1.1304482813752963,Select Service,Focused Service
Tru by Hilton Roanoke Hollins,ROARH,Hilto,82.0,2018-08-30,2168.17,0.60742,1316.99,Tru by Hilton,2,1.2698878837829757,Select Service,Focused Service
Home2 Suites by Hilton Fort Worth Northlake,DFWNL,Hilto,104.0,2018-09-26,2145.75,0.64414,1382.17,Home2 Suites by Hilton,3,0.9909042311091144,All Suites,Focused Service
Homewood Suites by Hilton Denver International Airport,DENIP,Hilto,117.0,2016-05-30,2137.7,0.56749,1213.13,Homewood Suites by Hilton,3,0.8774993358310681,All Suites,All Suites
Hampton Inn & Suites Tarpon Springs,TPATS,Hilto,84.0,2015-08-03,2085.71,0.53602,1117.98,Hampton Inn & Suites by Hilton,2,1.1925059050400042,Select Service,Focused Service
Home2 Suites by Hilton La Crosse,LSEHT,Hilto,107.0,2018-12-26,2040.23,0.67643,1380.08,Home2 Suites by Hilton,3,0.9157591200223777,All Suites,Focused Service
Hampton Inn & Suites Baton Rouge Downtown,BTRDN,Hilto,137.0,2015-03-13,2030.65,0.59473,1207.68,Hampton Inn & Suites by Hilton,3,0.7118695380625228,Select Service,Focused Service
Tru by Hilton Sterling Heights Detroit,DTWSH,Hilto,98.0,2018-05-15,2011.53,0.6134,1233.87,Tru by Hilton,2,0.9857943830700142,Select Service,Focused Service
Hampton Inn & Suites Trophy Club,FTWTC,Hilto,94.0,2015-03-11,2004.5,0.68782,1378.74,Hampton Inn & Suites by Hilton,2,1.0241512700804154,Select Service,Focused Service
Tru by Hilton Williamsville Buffalo Airport,BUFRU,Hilto,79.0,2018-04-04,2000.2,0.49843,996.96,Tru by Hilton,1,1.2159962414882695,Select Service,Focused Service
TRU by Hilton Garland Richardson,DALGL,Hilto,91.0,2018-01-23,1990.32,0.69555,1384.37,Tru by Hilton,2,1.050430723462575,Select Service,Focused Service
"Tru by Hilton Jackson, MI",LANJA,Hilto,93.0,2018-08-20,1959.84,0.5416,1061.45,Tru by Hilton,2,1.0121003374907196,Select Service,Focused Service
Hampton Inn & Suites Blythe,BLHBL,Hilto,81.0,2016-03-30,1953.91,0.5675,1108.84,Hampton Inn & Suites by Hilton,2,1.158525073914221,Select Service,Focused Service
Home2 Suites by Hilton Plymouth Minneapolis,MSPPL,Hilto,102.0,2018-08-22,1908.0,0.58695,1119.9,Home2 Suites by Hilton,3,0.8983883252459549,All Suites,Focused Service
Home2 Suites by Hilton Minneapolis - Eden Prarie,MSPEN,Hilto,102.0,2018-09-06,1907.4,0.61592,1174.81,Home2 Suites by Hilton,3,0.8981058131939907,All Suites,Focused Service
Tru by Hilton Wichita Northeast,MCIWI,Hilto,98.0,2018-06-22,1905.5,0.61419,1170.33,Tru by Hilton,2,0.9338320566632922,Select Service,Focused Service
Hampton Inn Rapid City,RAPHA,Hilto,82.0,2018-02-08,1889.13,0.58574,1106.53,Hampton Inn by Hilton,2,1.106455350775508,Select Service,Focused Service
"Home2 Suites by Hilton Columbus, GA",CSGBP,Hilto,81.0,2018-11-20,1880.75,0.6134,1153.65,Home2 Suites by Hilton,2,1.1151465690662163,All Suites,Focused Service
Tru by Hilton Lawrence,LWCNE,Hilto,82.0,2018-12-19,1858.71,0.58106,1080.02,Tru by Hilton,2,1.0886384870495647,Select Service,Focused Service
Hotel MdR Marina Del Ray - a DoubleTree by Hilton,LAXMA,Hilto,283.0,2018-01-23,1834.14,0.61141,1121.41,DoubleTree by Hilton,5,0.3112661885095947,Full Service,Full Service
Hampton Inn Denver-Gateway Park,DENAP,Hilto,115.0,2016-05-30,1798.02,0.65134,1171.13,Hampton Inn by Hilton,3,0.7509008203855193,Select Service,Focused Service
Hampton Inn Charleston Southridge,CRWSO,Hilto,139.0,2015-06-17,1796.78,0.46655,838.29,Hampton Inn by Hilton,3,0.620820437437271,Select Service,Focused Service
Hilton Garden Inn Bristol,TRIGI,Hilto,104.0,2015-04-03,1770.16,0.65614,1161.47,Hilton Garden Inn,3,0.8174573150367517,Select Service,Focused Service
Homewood Suites by Hilton Ottawa Downtown,YOWQS,Hilto,171.0,2018-12-31,1739.25,0.62735,1091.11,Homewood Suites by Hilton,4,0.4884856414290422,All Suites,All Suites
Homewood Suites Poplar,MEMPO,Hilto,140.0,2013-12-16,1735.85,0.48164,836.05,Homewood Suites by Hilton,3,0.5954839479880782,All Suites,All Suites
Homewood Suites Denver Tech Center,DENHW,Hilto,113.0,2013-10-09,1709.04,0.64718,1106.06,Homewood Suites by Hilton,3,0.7263729870716285,All Suites,All Suites
Hilton Garden Inn Cedar Falls,ALOCF,Hilto,113.0,2018-01-12,1707.51,0.55124,941.25,Hilton Garden Inn,3,0.7257227093307801,Select Service,Focused Service
"Hilton Garden Inn Fredericton, New Brunswick",YFCNW,Hilto,110.0,2018-09-18,1681.0,0.52993,890.82,Hilton Garden Inn,3,0.7339406280890124,Select Service,Focused Service
Hampton Inn Magnolia,AGOSN,Hilto,68.0,2018-04-03,1559.77,0.62211,970.35,Hampton Inn by Hilton,1,1.101634558230254,Select Service,Focused Service
Hampton Inn & Suites Riverton,RIWWY,Hilto,89.0,2018-05-03,1558.8,0.57264,892.63,Hampton Inn & Suites by Hilton,2,0.841174873284139,Select Service,Focused Service
Hilton Garden Inn Kennett Square,PHLKS,Hilto,92.0,2015-07-22,1540.28,0.63923,984.6,Hilton Garden Inn,2,0.8040772041074402,Select Service,Focused Service
Embassy Suites Blue Ash,CVGBA,Hilto,234.0,2016-08-30,1534.5,0.73624,1129.76,Embassy Suites,5,0.3149466086992501,All Suites,All Suites
Delta Colonial Hotel,RDLN01,Marri,100.0,2014-11-24,1518.25,0.62988,956.31,Delta Hotels,3,0.729170668920736,Full Service,Classic Premium
Hampton Inn Waterloo,ALOIA,Hilto,101.0,2018-01-30,1507.56,0.5716,861.72,Hampton Inn by Hilton,3,0.7168678984162296,Select Service,Focused Service
Candlewood Suites - Fort Collins,FCLCW,IHG,83.0,2018-12-13,1485.35,0.65166,967.94,Candlewood Suites,2,0.8594816504269661,All Suites,All Suites
Homewood Suites Philadelphia Valley Forge,PHLHW,Hilto,123.0,2015-06-21,1476.17,0.67011,989.2,Homewood Suites by Hilton,3,0.5763909648548209,All Suites,All Suites
Hampton Inn & Suites DuPont,SEADP,Hilto,115.0,2015-08-13,1469.25,0.62139,912.98,Hampton Inn & Suites by Hilton,3,0.6135977521670639,Select Service,Focused Service
Home2 Suites by Hilton Chicago McCormick Place,CHIMI,Hilto,95.0,2018-08-07,1451.0,0.72358,1049.92,Home2 Suites by Hilton,2,0.7335499774525643,All Suites,Focused Service
Hilton Garden Inn Dallas Downtown,DALPA,Hilto,171.0,2018-04-13,1450.0,0.52519,761.52,Hilton Garden Inn,4,0.4072469053167234,Select Service,Focused Service
Comfort Suites Downtown Orlando,FL094,Choic,122.0,2017-07-13,1415.5,0.56638,801.71,Comfort Suites,3,0.5572318657736889,Other,Other
Tru by Hilton Bryan College Station,CLLCS,Hilto,98.0,2018-08-27,1413.74,0.58306,824.3,Tru by Hilton,2,0.6928342859024732,Select Service,Focused Service
Tru by Hilton Amarillo West,AMATX,Hilto,90.0,2018-08-27,1398.2,0.59648,834.0,Tru by Hilton,2,0.7461268853284836,Select Service,Focused Service
Tru by Hilton Shepherdsville Louisville South,SDFRU,Hilto,83.0,2018-12-06,1393.08,0.58479,814.66,Tru by Hilton,2,0.8060906167413727,Select Service,Focused Service
Holiday Inn Express & Suites Kansas City Airport,MKCAI,IHG,109.0,2018-06-25,1375.3,0.72663,999.34,Holiday Inn Express & Suites,3,0.6059779840483224,Other,Other
Hampton Inn & Suites Fort Lauderdale Miramar,FLLMM,Hilto,122.0,2015-07-23,1374.75,0.73352,1008.4,Hampton Inn & Suites by Hilton,3,0.5411900441344958,Select Service,Focused Service
"Hampton Inn Middletown, NY",MLTNY,Hilto,127.0,2015-05-14,1372.03,0.59076,810.54,Hampton Inn by Hilton,3,0.5188547386738604,Select Service,Focused Service
