Property Name,Property Code,Brand,#Rooms,Activation Date,Revenue,Profit Margin,Gross Profit,Flag,Size Subset,SPOR,Group,Type
Hilton Garden Inn Tampa - Wesley Chapel,TPAWL,Hilto,124.0,2018-10-04,3242.88,0.72803,2360.93,Hilton Garden Inn,3,1.2560157751813563,Select Service,Focused Service
Hilton Garden Inn Orlando Airport,ORLAH,Hilto,132.0,2013-11-21,3217.23,0.71234,2291.77,Hilton Garden Inn,3,1.1705610781810496,Select Service,Focused Service
Home2 Suites Parc Lafayette,LFTHT,Hilto,106.0,2016-08-03,3189.95,0.58192,1856.31,Home2 Suites by Hilton,3,1.4453196644123554,All Suites,Focused Service
"Hilton Garden Inn Beaumont, TX",BPTGI,Hilto,100.0,2015-09-07,3127.25,0.4647,1453.24,Hilton Garden Inn,3,1.5019258846582393,Select Service,Focused Service
Home2 Suites by Hilton La Crosse,LSEHT,Hilto,107.0,2018-12-26,3124.2,0.65818,2056.3,Home2 Suites by Hilton,3,1.4023000557652383,All Suites,Focused Service
Tru by Hilton Deadwood,RAPSD,Hilto,108.0,2018-06-28,3098.17,0.62154,1925.63,Tru by Hilton,3,1.3777403878308707,Select Service,Focused Service
Tru by Hilton Roanoke Hollins,ROARH,Hilto,82.0,2018-08-30,3082.61,0.62101,1914.33,Tru by Hilton,2,1.805471475681445,Select Service,Focused Service
DoubleTree by Hilton Hotel San Francisco Airport,SFOAO,Hilto,395.0,2018-05-24,3040.36,0.60646,1843.86,DoubleTree by Hilton,5,0.3696696663104964,Full Service,Full Service
Home2 Suites by Hilton Irving / DFW Airport North,DALIV,Hilto,93.0,2018-09-27,3036.49,0.63189,1918.72,Home2 Suites by Hilton,2,1.5681038012221382,All Suites,Focused Service
Crowne Plaza Atlanta Airport,IHG-ATLAT,IHG,378.0,2017-06-27,11632.9,0.65931,7669.72,Crowne Plaza,5,1.4780260750791352,Full service,Full service
Hampton Inn & Suites Mount Vernon Belvoir Alexandria South Area,WASFB,Hilto,131.0,2014-12-30,3027.0,0.56419,1707.79,Hampton Inn & Suites by Hilton,3,1.109754784887215,Select Service,Focused Service
Hilton Garden Inn Knoxville West Cedar Bluff,TYSKH,Hilto,118.0,2014-09-22,3025.8,0.68631,2076.63,Hilton Garden Inn,3,1.2315274945900376,Select Service,Focused Service
Hilton Garden Inn Omaha East Council Bluffs,OMAEA,Hilto,153.0,2015-03-20,3009.95,0.57637,1734.85,Hilton Garden Inn,4,0.9448301675660593,Select Service,Focused Service
Tru by Hilton Staunton,SHDST,Hilto,90.0,2018-11-09,2980.42,0.61299,1826.98,Tru by Hilton,2,1.5904530765060214,Select Service,Focused Service
TRU by Hilton York,THVPA,Hilto,106.0,2017-10-12,2978.77,0.58082,1730.12,Tru by Hilton,3,1.349637096744962,Select Service,Focused Service
Tru By Hilton St. Charles St. Louis,STLMO,Hilto,87.0,2018-06-21,2978.37,0.63321,1885.93,Tru by Hilton,2,1.6441646142003725,Select Service,Focused Service
Homewood Suites Asheville Tunnel Road,AVLHW,Hilto,94.0,2014-10-31,2953.55,0.55855,1649.7,Homewood Suites by Hilton,2,1.5090456391848397,All Suites,All Suites
Tru By Hilton Cedar Rapids Westdale,CIDRU,Hilto,95.0,2018-02-16,2937.38,0.64609,1897.8,Tru by Hilton,2,1.4849862389866393,Select Service,Focused Service
Homewood Suites Reading,RDGPA,Hilto,119.0,2015-05-14,2922.45,0.69756,2038.59,Homewood Suites by Hilton,3,1.1794676375179878,All Suites,All Suites
Tru By Hilton Tallahassee Central,TLHCN,Hilto,90.0,2018-04-04,2916.76,0.65481,1909.92,Tru by Hilton,2,1.556481943964174,Select Service,Focused Service
"Homewood Suites Lafayette Airport, LA",LFTKS,Hilto,129.0,2014-10-28,2887.1,0.55357,1598.21,Homewood Suites by Hilton,3,1.0748751371190859,All Suites,All Suites
Hampton Inn York,YRKPA,Hilto,144.0,2015-04-28,2843.67,0.72858,2071.84,Hampton Inn by Hilton,3,0.9484241524826783,Select Service,Focused Service
Hampton Inn & Suites Glendale,LAXGL,Hilto,94.0,2017-08-14,2812.26,0.56495,1588.78,Hampton Inn & Suites by Hilton,2,1.4368568973790719,Select Service,Focused Service
Hilton Garden Inn Memphis Wolfchase Galleria,MEMCW,Hilto,124.0,2015-03-07,2783.85,0.69538,1935.83,Hilton Garden Inn,3,1.0782266120666255,Select Service,Focused Service
Tru By Hilton Cheyenne,CYSND,Hilto,100.0,2017-08-14,2765.58,0.57672,1594.97,Tru by Hilton,3,1.3282264571406615,Select Service,Focused Service
Home2 Suites Birmingham Colonnade,BHMHT,Hilto,107.0,2018-05-14,2763.57,0.57079,1577.43,Home2 Suites by Hilton,3,1.2404309471580373,All Suites,Focused Service
Hilton Garden Inn Allentown Bethlehem Airport,ABEGI,Hilto,106.0,2015-01-15,2718.68,0.71577,1945.95,Hilton Garden Inn,3,1.2317941238090195,Select Service,Focused Service
Tru by Hilton Syracuse North Airport Area,SYRAA,Hilto,93.0,2018-06-22,2656.14,0.61243,1626.7,Tru by Hilton,2,1.3716834998890726,Select Service,Focused Service
Home2 Suites by Hilton Dallas Grand Prairie,DFWGP,Hilto,96.0,2018-10-17,2566.74,0.64222,1648.4,Home2 Suites by Hilton,2,1.284093201290967,All Suites,Focused Service
Hampton Inn & Suites Los Angeles Burbank Airport,LAXBK,Hilto,99.0,2014-11-18,2504.17,0.66795,1672.67,Hampton Inn & Suites by Hilton,2,1.214827220993894,Select Service,Focused Service
Hampton Inn & Suites Asheville (I-26),AVLAP,Hilto,95.0,2014-10-13,2439.66,0.63811,1556.76,Hampton Inn & Suites by Hilton,2,1.2333649469275831,Select Service,Focused Service
Hampton Inn Oneonta,ONHNJ,Hilto,106.0,2014-12-08,2420.85,0.50992,1234.45,Hampton Inn by Hilton,3,1.0968517091467422,Select Service,Focused Service
Hampton Inn & Suites Baton Rouge Downtown,BTRDN,Hilto,137.0,2015-03-13,2386.88,0.66565,1588.82,Hampton Inn & Suites by Hilton,3,0.8367503819026787,Select Service,Focused Service
Hampton Inn Jupiter/Juno Beach,PBIJB,Hilto,89.0,2016-12-27,2333.03,0.528,1231.83,Hampton Inn by Hilton,2,1.258972424055745,Select Service,Focused Service
Tru by Hilton Sterling Heights Detroit,DTWSH,Hilto,98.0,2018-05-15,2315.17,0.61953,1434.32,Tru by Hilton,2,1.1345998229468142,Select Service,Focused Service
"Hilton Garden Inn Fredericton, New Brunswick",YFCNW,Hilto,110.0,2018-09-18,2312.0,0.52813,1221.03,Hilton Garden Inn,3,1.0094412445816756,Select Service,Focused Service
Homewood Suites Durham Chapel Hill (I-40),RDUHW,Hilto,96.0,2015-08-11,2274.38,0.54808,1246.54,Homewood Suites by Hilton,2,1.137830826321384,All Suites,All Suites
Tru by Hilton Lafayette,LFTRU,Hilto,98.0,2018-10-24,2257.5,0.61629,1391.28,Tru by Hilton,2,1.1063373749238425,Select Service,Focused Service
Tru by Hilton Wichita Northeast,MCIWI,Hilto,98.0,2018-06-22,2241.7,0.6408,1436.49,Tru by Hilton,2,1.098594238479193,Select Service,Focused Service
Hilton Garden Inn Jackson/Clinton,JANCL,Hilto,107.0,2018-11-08,2204.7,0.60487,1333.56,Hilton Garden Inn,3,0.9895816314402475,Select Service,Focused Service
Hampton Inn Titusville (I-95) Kennedy Space Center,TIXFL,Hilto,86.0,2015-11-18,2202.45,0.58189,1281.58,Hampton Inn by Hilton,2,1.2299671360957,Select Service,Focused Service
Hampton Inn Rapid City,RAPHA,Hilto,82.0,2018-02-08,2192.32,0.58624,1285.23,Hampton Inn by Hilton,2,1.2840324353602777,Select Service,Focused Service
Hilton Garden Inn Cincinnati Blue Ash,CVGBO,Hilto,122.0,2018-09-28,2163.85,0.47769,1033.65,Hilton Garden Inn,3,0.8518305706495207,Select Service,Focused Service
Hampton Inn & Suites by Hilton Snellville,ATLSV,Hilto,100.0,2018-12-20,2143.36,0.66116,1417.11,Hampton Inn & Suites by Hilton,3,1.0293925538863486,Select Service,Focused Service
Hampton Inn & Suites Trophy Club,FTWTC,Hilto,94.0,2015-03-11,2128.3,0.67991,1447.05,Hampton Inn & Suites by Hilton,2,1.087403915246769,Select Service,Focused Service
Hampton Inn Orlando International Drive/Convention Center,MCOCC,Hilto,170.0,2018-01-29,2124.61,0.68533,1456.05,Hampton Inn by Hilton,4,0.6002279307235246,Select Service,Focused Service
Hampton Inn Kennewick at Southridge,VSKTC,Hilto,80.0,2015-06-29,2115.15,0.50788,1074.24,Hampton Inn by Hilton,2,1.2698051542628808,Select Service,Focused Service
Avid Hotel Oklahoma City - Quail Springs,OKCAV,IHG,87.0,2018-08-07,2081.95,0.53413,1112.03,Avid Hotels,2,1.1493093599970674,All Suites,Focused Service
Hampton Inn & Suites Lincoln Northeast I-80,LNKNH,Hilto,83.0,2015-05-19,2078.15,0.69717,1448.83,Hampton Inn & Suites by Hilton,2,1.2024989341466992,Select Service,Focused Service
Hampton Inn & Suites Southwest/Sioux Falls,FSDSW,Hilto,93.0,2018-11-09,2050.03,0.60392,1238.05,Hampton Inn & Suites by Hilton,2,1.0586762464620072,Select Service,Focused Service
Hampton Inn & Suites Riverton,RIWWY,Hilto,89.0,2018-05-03,2006.96,0.55987,1123.63,Hampton Inn & Suites by Hilton,2,1.08301534750214,Select Service,Focused Service
Hilton Garden Inn Mobile West I-65/Airport Blvd.,MOBWS,Hilto,101.0,2017-02-10,1936.96,0.7069,1369.24,Hilton Garden Inn,3,0.9210541832605668,Select Service,Focused Service
"Tru by Hilton Jackson, MI",LANJA,Hilto,93.0,2018-08-20,1929.57,0.67837,1308.97,Tru by Hilton,2,0.9964683077251041,Select Service,Focused Service
Homewood Suites by Hilton Ft.Lauderdale Airport-Cruise Port,FLLAR,Hilto,124.0,2018-08-29,1896.15,0.51261,971.99,Homewood Suites by Hilton,3,0.7344071665032714,All Suites,All Suites
Homewood Suites Denver Tech Center,DENHW,Hilto,113.0,2013-10-09,1886.02,0.69371,1308.35,Homewood Suites by Hilton,3,0.801592695944409,All Suites,All Suites
Homewood Suites Philadelphia Valley Forge,PHLHW,Hilto,123.0,2015-06-21,1874.24,0.71423,1338.63,Homewood Suites by Hilton,3,0.7318228943614213,All Suites,All Suites
Homewood Suites by Hilton Syracuse/Liverpool,SYRHW,Hilto,102.0,2018-06-07,1872.56,0.58837,1101.76,Homewood Suites by Hilton,3,0.8817012800432732,All Suites,All Suites
TRU by Hilton Sumter,SSCSC,Hilto,90.0,2018-08-07,1857.9,0.61315,1139.18,Tru by Hilton,2,0.9914383780945428,Select Service,Focused Service
Embassy Suites by Hilton Memphis,MEMPE,Hilto,220.0,2018-01-31,1794.84,0.69028,1238.94,Embassy Suites,5,0.39182212876837685,All Suites,All Suites
Crowne Plaza Seattle-Downtown,SEADT,IHG,465.0,2018-08-10,11959.82,0.57796,6912.3,Crowne Plaza,5,1.2352577616875111,Full service,Full service
Hampton Inn Waterloo,ALOIA,Hilto,101.0,2018-01-30,1779.01,0.5494,977.38,Hampton Inn by Hilton,3,0.8459465360990319,Select Service,Focused Service
Home2 Suites by Hilton Fort Worth Northlake,DFWNL,Hilto,104.0,2018-09-26,1761.5,0.64819,1141.79,Home2 Suites by Hilton,3,0.8134581396242363,All Suites,Focused Service
Staybridge Suites - Wilmington Brandywine Valley,PHLFD,IHG,110.0,2018-08-02,1725.46,0.62233,1073.81,Staybridge Suites,3,0.7533522880086064,All Suites,Focused Suites
La Quinta Inn & Suites Atlanta Airport North,6739,Wyndh,188.0,2016-10-04,1724.19,0.68621,1183.15,La Quinta Inn & Suites,4,0.4404667943028066,Other,Other
Homewood Suites Reno,RNOHW,Hilto,96.0,2015-08-09,1700.98,0.58126,988.71,Homewood Suites by Hilton,2,0.8509692658905496,All Suites,All Suites
Hampton Inn Harrisburg West,HRBPA,Hilto,129.0,2015-04-30,1637.58,0.66899,1095.53,Hampton Inn by Hilton,3,0.6096754622435914,Select Service,Focused Service
Hampton Inn & Suites Blythe,BLHBL,Hilto,81.0,2016-03-30,1637.48,0.55598,910.4,Hampton Inn & Suites by Hilton,2,0.970905332401727,Select Service,Focused Service
Tru by Hilton Williamsville Buffalo Airport,BUFRU,Hilto,79.0,2018-04-04,1636.97,0.51974,850.8,Tru by Hilton,1,0.9951751661979065,Select Service,Focused Service
"Home2 Suites by Hilton Columbus, GA",CSGBP,Hilto,81.0,2018-11-20,1633.9,0.61605,1006.56,Home2 Suites by Hilton,2,0.9687826554285743,All Suites,Focused Service
Hampton Inn & Suites Phenix City- Columbus Area,CSGPC,Hilto,81.0,2018-09-19,1627.99,0.57857,941.9,Hampton Inn & Suites by Hilton,2,0.9652784596432857,Select Service,Focused Service
Home2 Suites by Hilton Minneapolis - Eden Prarie,MSPEN,Hilto,102.0,2018-09-06,1621.0,0.58268,944.52,Home2 Suites by Hilton,3,0.7632533937231094,All Suites,Focused Service
Hilton Garden Inn Bristol,TRIGI,Hilto,104.0,2015-04-03,1613.42,0.63981,1032.29,Hilton Garden Inn,3,0.7450750108615017,Select Service,Focused Service
Hampton Inn Charleston Southridge,CRWSO,Hilto,139.0,2015-06-17,1610.32,0.45262,728.86,Hampton Inn by Hilton,3,0.5563950883324538,Select Service,Focused Service
Hotel MdR Marina Del Ray - a DoubleTree by Hilton,LAXMA,Hilto,283.0,2018-01-23,1601.44,0.63342,1014.39,DoubleTree by Hilton,5,0.2717753960585371,Full Service,Full Service
Hilton Garden Inn Saskatoon Downtown,YXESD,Hilto,180.0,2014-10-08,1591.64,0.65231,1038.25,Hilton Garden Inn,4,0.42467651114440985,Select Service,Focused Service
Hampton Inn & Suites DuPont,SEADP,Hilto,115.0,2015-08-13,1588.5,0.69723,1107.55,Hampton Inn & Suites by Hilton,3,0.6633997136752635,Select Service,Focused Service
Hilton Garden Inn Cedar Falls,ALOCF,Hilto,113.0,2018-01-12,1577.31,0.58577,923.94,Hilton Garden Inn,3,0.6703853486389729,Select Service,Focused Service
Tru by Hilton Auburn,CSGAA,Hilto,98.0,2018-03-29,1560.72,0.66478,1037.53,Tru by Hilton,2,0.7648650577147905,Select Service,Focused Service
Candlewood Suites - Fort Collins,FCLCW,IHG,83.0,2018-12-13,1555.62,0.65742,1022.7,Candlewood Suites,2,0.9001426229758622,All Suites,All Suites
Homewood Suites by Hilton Denver International Airport,DENIP,Hilto,117.0,2016-05-30,1545.14,0.58434,902.89,Homewood Suites by Hilton,3,0.6342608054292074,All Suites,All Suites
Hampton Inn & Suites Palm Desert,PLMHS,Hilto,88.0,2014-10-30,1509.21,0.59953,904.81,Hampton Inn & Suites by Hilton,2,0.8236693451206265,Select Service,Focused Service
Home2 Suites by Hilton Hilton Head,HHHHT,Hilto,99.0,2018-11-01,1499.2,0.62935,943.52,Home2 Suites by Hilton,2,0.7272944607251288,All Suites,Focused Service
Tru by Hilton Lawrence,LWCNE,Hilto,82.0,2018-12-19,1484.43,0.56924,845.0,Tru by Hilton,2,0.8694242939086707,Select Service,Focused Service
Home2Suites KCI Airport,MCIKA,Hilto,91.0,2018-06-12,1424.63,0.51745,737.18,Home2 Suites by Hilton,2,0.7518766437389406,All Suites,Focused Service
Homewood Suites by Hilton Ottawa Downtown,YOWQS,Hilto,171.0,2018-12-31,1423.15,0.50684,721.31,Homewood Suites by Hilton,4,0.39970581606999656,All Suites,All Suites
"Hampton Inn Middletown, NY",MLTNY,Hilto,127.0,2015-05-14,1371.9,0.63432,870.23,Hampton Inn by Hilton,3,0.5188055771278101,Select Service,Focused Service
Homewood Suites Poplar,MEMPO,Hilto,140.0,2013-12-16,1336.62,0.48992,654.84,Homewood Suites by Hilton,3,0.4585279572312268,All Suites,All Suites
Hampton Inn Montrose,MTJCO,Hilto,64.0,2017-12-19,1332.75,0.60798,810.29,Hampton Inn by Hilton,1,1.0001257708341336,Select Service,Focused Service
Hampton Inn & Suites Tarpon Springs,TPATS,Hilto,84.0,2015-08-03,1324.72,0.55797,739.15,Hampton Inn & Suites by Hilton,2,0.7574094301339086,Select Service,Focused Service
Hampton Inn Denver-Gateway Park,DENAP,Hilto,115.0,2016-05-30,1288.13,0.64876,835.69,Hampton Inn by Hilton,3,0.5379572383862243,Select Service,Focused Service
Hilton Garden Inn Fort Myers Airport FGCU,RSWFM,Hilto,164.0,2014-07-12,1284.79,0.58555,752.31,Hilton Garden Inn,4,0.37624800043482043,Select Service,Focused Service
Home2 Suites by Hilton Plymouth Minneapolis,MSPPL,Hilto,102.0,2018-08-22,1267.25,0.60612,768.1,Home2 Suites by Hilton,3,0.5966889964192539,All Suites,Focused Service
Hilton Garden Inn Kennett Square,PHLKS,Hilto,92.0,2015-07-22,1217.75,0.65144,793.29,Hilton Garden Inn,2,0.6357058556248444,Select Service,Focused Service
Hilton Garden Inn Wilkes Barre,AVPWI,Hilto,123.0,2015-06-02,1215.5,0.65408,795.04,Hilton Garden Inn,3,0.4746087630699951,Select Service,Focused Service
Hampton Inn Magnolia,AGOSN,Hilto,68.0,2018-04-03,1208.86,0.61895,748.22,Hampton Inn by Hilton,1,0.8537937978434159,Select Service,Focused Service
Hilton Philadelphia City Avenue,PHLPH,Hilto,209.0,2015-09-03,1205.85,0.63403,764.55,Full Services,5,0.2770976882122595,Other,Other
Delta Colonial Hotel,RDLN01,Marri,100.0,2014-11-24,1169.14,0.67485,788.99,Delta Hotels,3,0.5615034387366965,Full Service,Classic Premium
Hampton Inn Eufaula,EUFHX,Hilto,78.0,2018-09-24,1145.55,0.60409,692.02,Hampton Inn by Hilton,1,0.7053510998933059,Select Service,Focused Service
Hampton Inn & Suites Lake Jackson Clute,LJNCL,Hilto,67.0,2015-08-26,1127.81,0.49239,555.32,Hampton Inn & Suites by Hilton,1,0.8084385961994691,Select Service,Focused Service
Hampton Inn Orlando-Maingate South,MCOSW,Hilto,83.0,2018-02-08,1098.95,0.6037,663.44,Hampton Inn by Hilton,2,0.6358954857351563,Select Service,Focused Service
Tru by Hilton Bryan College Station,CLLCS,Hilto,98.0,2018-08-27,1038.53,0.65235,677.48,Tru by Hilton,2,0.5089543982191177,Select Service,Focused Service
Tru by Hilton Shepherdsville Louisville South,SDFRU,Hilto,83.0,2018-12-06,1019.67,0.63459,647.07,Tru by Hilton,2,0.59002097451164,Select Service,Focused Service
Hampton Inn & Suites Red Deer,YQFRD,Hilto,110.0,2014-12-15,1013.59,0.52581,532.96,Hampton Inn & Suites by Hilton,3,0.4425430584323272,Select Service,Focused Service
Hampton Inn Winchester-University/Mall Area,WNCVA,Hilto,101.0,2018-03-13,987.49,0.5437,536.9,Hampton Inn by Hilton,3,0.469566638148427,Select Service,Focused Service
Hampton Inn Henderson,HDSNC,Hilto,75.0,2018-09-26,942.28,0.54985,518.11,Hampton Inn by Hilton,1,0.6033990343361381,Select Service,Focused Service
Hampton Inn & Suites Fort Lauderdale Miramar,FLLMM,Hilto,122.0,2015-07-23,933.0,0.703,655.9,Hampton Inn & Suites by Hilton,3,0.3672888242789486,Select Service,Focused Service
Home2 Suites by Hilton Murfreesboro,MBTHT,Hilto,75.0,2017-09-18,887.43,0.71739,636.63,Home2 Suites by Hilton,1,0.5682752526222767,All Suites,Focused Service
The Saratoga Hilton (Coffee Shop),ALBSA:Coffee Shop,Hilto,245.0,2017-08-11,686.27,0.70408,483.19,Hilton Hotels & Resorts,5,0.13452866450303178,Full Service,Full Service
Hilton Garden Inn Orange Beach Beachfront,ORBHH,Hilto,137.0,2015-10-23,660.25,0.57989,382.87,Hilton Garden Inn,3,0.23145882476339136,Select Service,Focused Service
Hampton Inn Greensboro-East,GSOEA,Hilto,78.0,2018-09-29,651.41,0.50593,329.57,Hampton Inn by Hilton,1,0.4010935882165758,Select Service,Focused Service
Hampton Inn Searcy,SRCSP,Hilto,73.0,2018-04-04,606.24,0.4869,295.18,Hampton Inn by Hilton,1,0.3988481929461028,Select Service,Focused Service
Hilton Garden Inn Times Square,NYCMW,Hilto,369.0,2017-10-27,45224.68,0.70148,31724.26,Hilton Garden Inn,5,5.886200311267338,Select Service,Focused Service
Hilton Garden Inn New York/West 35th Street,NYCTF,Hilto,298.0,2018-11-13,38899.26,0.55215,21478.1,Hilton Garden Inn,5,6.2691834215526825,Select Service,Focused Service
DoubleTree Suites by Hilton Hotel Boston - Cambridge,BOSSB,Hilto,308.0,2018-06-11,33547.73,0.71842,24101.25,DoubleTree by Hilton,5,5.231163853820133,Full Service,Full Service
Crowne Plaza Atlanta Airport,IHG-ATLAT,IHG,378.0,2017-06-27,11981.49,0.66325,7946.73,Crowne Plaza,5,1.5223164162246652,Full service,Full service
Crowne Plaza Atlanta Airport,IHG-ATLAT,IHG,378.0,2017-06-27,12105.4,0.65469,7925.3,Crowne Plaza,5,1.5380598861215142,Full service,Full service
Embassy Suites Portland Washington Square,PDXBV,Hilto,356.0,2015-12-17,17620.25,0.62493,11011.46,Embassy Suites,5,2.3771028292572574,All Suites,All Suites
InterContinental New Orleans,MSYHA,IHG,484.0,2018-09-20,17042.25,0.69726,11882.85,InterContinental,5,1.6910929193999744,Full Service,Full Service
Homewood Suites New Orleans,MSYFR,Hilto,207.0,2017-07-20,16483.86,0.70085,11552.79,Homewood Suites by Hilton,5,3.8244983052716157,All Suites,All Suites
Hilton Garden Inn Staten Island,ewrsi,Hilto,198.0,2015-03-03,16141.79,0.66728,10771.1,Hilton Garden Inn,4,3.9153663464475312,Select Service,Focused Service
Homewood Suites Savannah Historic District,SAVRB,Hilto,162.0,2018-04-10,15841.34,0.61738,9780.1,Homewood Suites by Hilton,4,4.696375368978178,All Suites,All Suites
Embassy Suites by Hilton Washington DC Convention Center,WASCC,Hilto,384.0,2018-10-23,15825.8,0.73358,11609.45,Embassy Suites,5,1.979339764155172,All Suites,All Suites
Crowne Plaza Seattle-Downtown,SEADT,IHG,465.0,2018-08-10,12153.24,0.56733,6894.88,Crowne Plaza,5,1.2552349483228953,Full service,Full service
Crowne Plaza Kansas City Downtown,MKCWS,IHG,385.0,2018-11-27,12235.0,0.63943,7823.46,Crowne Plaza,5,1.5262621882670293,Full service,Full service
Home2 Suites by Hilton Los Angeles Montebello,LGBMO,Hilto,203.0,2018-09-19,13575.73,0.71202,9666.23,Home2 Suites by Hilton,5,3.211833732344263,All Suites,Focused Service
Hilton Garden Inn Seattle Bellevue Downtown,SEABE,Hilto,254.0,2018-05-09,13529.5,0.63283,8561.86,Hilton Garden Inn,5,2.5581966818830475,Select Service,Focused Service
Embassy Suites Crystal City National Airport,WASCR,Hilto,267.0,2015-09-25,12965.54,0.73922,9584.38,Embassy Suites,5,2.33219708890609,All Suites,All Suites
Hilton Denver Inverness,DENIR,Hilto,302.0,2018-02-15,12690.66,0.65416,8301.7,Hilton Hotels & Resorts,5,2.018195190577691,Full Service,Full Service
Crowne Plaza White Plains-Downtown,HPNCP,IHG,402.0,2018-12-06,12241.79,0.66136,8096.25,Crowne Plaza,5,1.4625299655333048,Full service,Full service
DoubleTree by Hilton Deadwood at Cadillac Jack's,RAPDW,Hilto,107.0,2018-12-28,12419.98,0.45269,5622.43,DoubleTree by Hilton,3,5.5747194951037535,Full Service,Full Service
Crowne Plaza Seattle-Downtown,SEADT,IHG,465.0,2018-08-10,12334.11,0.57013,7032.09,Crowne Plaza,5,1.2739159210596438,Full service,Full service
Embassy Suites by Hilton Miami International Airport,MIASP,Hilto,318.0,2018-02-06,12119.18,0.62951,7629.15,Embassy Suites,5,1.8303410367511435,All Suites,All Suites
Hampton Inn Manhattan Times Square Central,NYCFF,Hilto,300.0,2015-07-01,10908.93,0.54315,5925.21,Hampton Inn by Hilton,5,1.7464123794521074,Select Service,Focused Service
Hilton Garden Inn Chicago North Shore/Evanston,ORDEV,Hilto,178.0,2018-11-09,10345.65,0.67231,6955.46,Hilton Garden Inn,4,2.7914103245419724,Select Service,Focused Service
Embassy Suites Orlando Airport,MCOAT,Hilto,174.0,2018-02-02,10239.75,0.7077,7246.62,Embassy Suites,4,2.826350421246901,All Suites,All Suites
Embassy Suites Orlando - International Drive / Convention Center,MCOOR,Hilto,244.0,2016-12-04,10143.19,0.64915,6584.47,Embassy Suites,5,1.9965060715637666,All Suites,All Suites
Crowne Plaza Orlando Downtown,MCOOA,IHG,227.0,2017-10-09,12421.97,0.70784,8792.74,Crowne Plaza,5,2.6281522458294324,Full service,Full service
Crowne Plaza White Plains-Downtown,HPNCP,IHG,402.0,2018-12-06,12618.42,0.64313,8115.25,Crowne Plaza,5,1.50752605359876,Full service,Full service
Hampton Inn & Suites Pittsburgh Downtown,PITDN,Hilto,143.0,2014-12-30,8398.45,0.63857,5362.99,Hampton Inn & Suites by Hilton,3,2.8206487292244393,Select Service,Focused Service
DoubleTree Annapolis,ANPDT,Hilto,224.0,2016-08-05,8151.02,0.68183,5557.62,DoubleTree by Hilton,5,1.7476314088666165,Full Service,Full Service
Crowne Plaza White Plains-Downtown,HPNCP,IHG,402.0,2018-12-06,12692.3,0.65506,8314.25,Crowne Plaza,5,1.5163525172003738,Full service,Full service
Embassy Suites Lombard,CHILM,Hilto,262.0,2016-09-14,7789.38,0.62042,4832.67,Embassy Suites,5,1.427866158953547,All Suites,All Suites
Crowne Plaza Seattle-Downtown,SEADT,IHG,465.0,2018-08-10,12694.0,0.57736,7329.03,Crowne Plaza,5,1.3110867911775652,Full service,Full service
Hampton Inn & Suites LAX El Segundo,LAXEL,Hilto,171.0,2018-06-22,7602.61,0.66816,5079.73,Hampton Inn & Suites by Hilton,4,2.135268548158603,Select Service,Focused Service
Crowne Plaza Kansas City Downtown,MKCWS,IHG,385.0,2018-11-27,12766.25,0.6113,7803.97,Crowne Plaza,5,1.5925332783787465,Full service,Full service
Embassy Suites by Hilton Laredo,LRDES,Hilto,320.0,2018-02-16,7341.99,0.60803,4464.17,Embassy Suites,5,1.1019191008375917,All Suites,All Suites
Embassy Suites Seattle - Bellevue,SEABL,Hilto,240.0,2016-03-09,7260.98,0.5962,4329.02,Embassy Suites,5,1.4530143376749785,All Suites,All Suites
Hilton Garden Inn Washington DC Downtown,DCACH,Hilto,300.0,2015-09-29,7248.25,0.73109,5299.1,Hilton Garden Inn,5,1.1603735223677976,Select Service,Focused Service
Hilton Garden Inn Los Angeles Montebello,LGBMB,Hilto,121.0,2015-03-30,7188.32,0.70454,5064.49,Hilton Garden Inn,3,2.853171865072094,Select Service,Focused Service
Hilton Garden Inn Jacksonville Downtown Southbank,JAXSB,Hilto,123.0,2018-12-17,6749.5,0.65356,4411.18,Hilton Garden Inn,3,2.6354354967839835,Select Service,Focused Service
Tru by Hilton Chicopee Springfield,BDLRU,Hilto,108.0,2018-06-13,6687.74,0.60741,4062.22,Tru by Hilton,3,2.974003847856001,Select Service,Focused Service
Crowne Plaza Atlanta Airport,IHG-ATLAT,IHG,378.0,2017-06-27,12820.5,0.64928,8324.06,Crowne Plaza,5,1.6289174062832186,Full service,Full service
Embassy Suites Bloomington,MSPWE,Hilto,234.0,2015-10-19,6606.05,0.63124,4169.98,Embassy Suites,5,1.355850794654729,All Suites,All Suites
Tru by Hilton Pigeon Forge,TYSPF,Hilto,102.0,2018-06-18,6558.62,0.60236,3950.63,Tru by Hilton,3,3.0881486570883774,Select Service,Focused Service
Hampton Inn Indianapolis Dwtn Across from Circle Centre,INDDT,Hilto,180.0,2018-01-16,6184.3,0.54826,3390.6,Hampton Inn by Hilton,4,1.6500759894639327,Select Service,Focused Service
Hampton Inn & Suites Denver Downtown Convention Center,DENCV,Hilto,120.0,2013-10-14,5725.75,0.69419,3974.77,Hampton Inn & Suites by Hilton,3,2.291590623839346,Select Service,Focused Service
Hilton Garden Inn New York Midtown Park Ave,NYCET,Hilto,232.0,2015-10-15,5687.78,0.63843,3631.27,Hilton Garden Inn,5,1.1774452061055958,Select Service,Focused Service
Tru By Hilton Charlotte Ayrsley,CLTCA,Hilto,92.0,2018-04-27,5634.98,0.59058,3327.92,Tru by Hilton,2,2.941646300413784,Select Service,Focused Service
Hilton Dallas Plano Granite Park,DALPG,Hilto,299.0,2014-08-15,5551.25,0.71364,3961.62,Hilton Hotels & Resorts,5,0.8916727586595498,Full Service,Full Service
Hampton Inn & Suite Yonkers Westchester,LGAYW,Hilto,150.0,2016-12-14,5339.25,0.64924,3466.48,Hampton Inn & Suites by Hilton,4,1.7095228032427863,Select Service,Focused Service
Embassy Suites Dallas Love Field,DALLF,Hilto,248.0,2016-11-02,5337.17,0.61356,3274.68,Embassy Suites,5,1.0335827589711428,All Suites,All Suites
Hilton Garden Inn New Orleans French Quarter CBD,MSYOR,Hilto,155.0,2016-01-16,5175.72,0.66347,3433.95,Hilton Garden Inn,4,1.6037068205845788,Select Service,Focused Service
Hilton Garden Inn Cincinnati Midtown,CVGMD,Hilto,120.0,2018-10-17,5169.25,0.73621,3805.63,Hilton Garden Inn,3,2.06886518487212,Select Service,Focused Service
